7473,景德镇市发布雷电黄色预警：预计未来6小时我市中南部将出现雷电活动，局地可伴有短时强降水、雷雨大风等强对流天气，请注意防范！...
7474,媒体称湖南移动前任总经理王建根今日被查，下午被有关部门带走接受调查；湖南电信业官场地震或持续，湖南通信业大佬级人物，湖北移动大叔。
7475,"""【头条拌饭】公司透露姚贝娜仍昏迷暂无手术计划;范玮琪提前剖腹产两子宝宝暂待保温箱;范瑋琪提早剖腹生两子,暂待维温箱(图)"""
7476,怀化市发布道路结冰黄色预警：目前沅陵县、浦县、中方县、辰溪县、芷江县、麻阳县、洪江市、会同县、新晃县、鹤城区、洪城市、洪州市、鹤江区、鹤水区、
7477,衡阳：两兄妹为已故5年母亲退还7万多元养老金，去世后未发现多出75889.7元；因企业改制致其死亡，去年未退还社保部门；去年获评十大杰出母亲。
7478,宋军继任聊城市委副书记，曾任山东省住房和城乡建设厅厅长；王忠林辞职后，宋军接任聊市副书长，并决定继任代理市长；宋军任山西省民政厅副厅长
7479,哈尔滨：已婚女子七夕未见老同学，为免误会特地找另外两名同学作陪，为避误会，特地邀请其作陪；因不肯开房被其扇四个耳光，被老公扇四耳光。
7480,受冷空气影响，甘肃、宁夏部分地区出现大风、沙尘、降温天气，最低气温降至零下7度，部分棚内已出苗食用葵、棉花、红花、蜜瓜等农作物受灾，目前经济损失
7481,财政部：为帮助广西、云南两省做好对越自卫还击战烈士墓地维护和祭扫接待工作，中央财政分别下拨两省（区）烈士祭扫补助资金500万元，用于补助对越还卫战烈
7482,漳州试水大城管模式实施方案出台，将在全省率先试点城市综合管理，以数字城管技术为基础，打造大市管格局；市长任城管委主任，市长由市长担任。
7483,铜川：吸毒人员跑出200多米跌倒，追赶的辅警将其压在身下，抓获后受伤辅警才去医院；抓获瘾君子后，受伤后自残；因为躲避打击，刺伤后进行自残(图)
7484,组图：南京铁心桥四联东晋古墓发掘结束，4座东晋墓都没有被盗过，专家推测为胭脂；专家称该古墓属于抢救性的，专业称该墓葬属于罕见化妆品。
7485,漳州：13岁男孩被马戏团当成赚钱工具挨踩，称被小马戲团当作赚钱，逃跑时遇好心人才回到漳州长泰，逃走时遭到非人虐待；逃跑中遇好人人才来到长泰(图)
7486,韩媒：金正恩鼓励在劳动党建党70周年的统治，阻止比金正日时期更庞大的军队势力化；此前，金曾在朝鲜人民军进行新型反舰火箭发射试验，为对外展示成果。
7487,黑莓公司宣布已与谷歌达成伙伴关系，将为企业用户定制更加安全的安卓版本。
7488,长沙一司机驾车非法改装违法行为，被撞倒拖行致重伤，肇事司机称当天是带怀孕5个月妻子去做孕检；肇事车主称其当天系带孕孕5月月的妻子做妊检(组图)
7489,政知圈揭秘大老虎出庭时形象，不止廖少华一人；政知圏小编发现，大小虎面貌如同被卸妆；政改圈小编称其出庭后形象如同卸妆。
7490,组图：建湖女子在群里炮轰自己的老公：借高利贷出去养小三，并以裸照作为个人头像，以裸聊作为头像
7491,住建部、财政部、央行已发文，包括放松公积金贷款条件、推进异地贷款、降低中间费用三项内容，其中连缴6个月职工即可申请公积款贷款，连缴六个月的职工可
7492,上饶市发布雷电橙色预警：预计未来2小时内我县西部发生雷电活动的可能性很大，出现雷电灾害事故的可可性比较大。...
7493,外交部回应155名非法入境的中国维族人，中方是否要求马方移交这批人员？洪磊回应：注意到相关报道，正在核实有关情况。
7494,广州铁路两级法院将集中管辖广州地区的一审、二审行政案件，将全部由广州法院管辖，将继续在江门、湛江实行行政事件集中办理；继续对江门实行司法事件。
7495,湖北省发布暴雨红色预警：预计未来3小时，恩施有100毫米以上降水，伴有雷电大风，请加强对山洪、滑坡等灾害的防范...
7496,国家旅游局：每逢黄金周，看景变成看人，有的景区游客上不来，有景点游客不来；官方称将着力点落到黄金週旅游乱象上，将着重点落实到纸面上。
7497,中纪委第五次全体会议：王岐山主持中央纪委常委会第5次全会，决定今年中纪纪委委员125人，包括王岐强、张德江、王岐江、刘云山、张高丽等5人出席全会。
7498,快讯：台湾新北市八里乐园今晚举行派对时舞台突然起火，超百人烧伤，过百人被灼伤，目击者称舞台喷出大量粉末时，爆炸，目前现场布满血迹，现场乱，现
7499,广州一建筑清拆时倒塌，一台钩机操作失误所致，疑因操作错误致，司机当场死亡，施工方现场负责人已被警方控制；事发时楼房几乎全部被淹，事故原因不明。
7500,怀化市委书记彭国甫被请离会场，会场无人打手机、接手机，没有听到交头接耳说话声，没看到人员进进出出；会场秩序井然，没听到人打电机，也没有人打机机、
7501,金华：奇葩养父霸占养女，又卖掉养女亲生儿子，伙同妹妹与养女卖掉亲生孩子，并以给零花钱为借口要求与其发生关系；3岁时被父母遗弃，与其生子子(图)
7502,媒体称4省区成领导干部禁烟死角，4省市成领袖禁烟焦角，5省区未转发文件又没有举措，成死角；省委常委会通报禁烟通知不转发，成为死角
7503,发改委：今起取消绝大部分药品政府定价，完善药品采购机制，发挥医保控费作用，药品实际交易价格主要由市场竞争形成，刷卡手续费或降低
7504,天津：一司机困倦驾车撞死4名交警和2名清障人员被判6年10个月，并被判刑6年。
7505,中国自行研制的探月工程三期再入返回飞行试验器，在西昌卫星发射中心用长征三号丙运载火箭发射升空，准确进入近地点高度为209公里的地月转移轨道(组图)
7506,12306网站出现串号，用户登录后有可能看见其他用户的个人资料，目前该漏洞已修复，但@中国铁路并未对此发表评论。
7507,无锡：女子在地下停车场停10天车交805元停车费，目击者称女人家里条件不好，带孩子来看病的，实在没钱了；目击人回忆称是带孩儿来看医，实属无钱(图)
7508,欧冠抽签结果：曼联对阵比利时亚军瓦伦西亚，阿斯塔纳遭遇摩纳哥
7509,本月将举行本年度购车指标摇号，新能源车申请人数创新高，比上期增加118个；本期新能车审核人数少于指标数，无需摇号直接配置，本期摇号大军人数再创
7510,：休斯顿火箭与丹佛掘金达成了一笔交易，换来一个2017年的次轮选秀权
7511,岳阳：女子为逃脱父亲谋害，欲毒杀自己，自称身体已出现严重不适，甚至有生命危险；警方称其长期在食物中投铅粉，目的是获得保险赔偿，警方已介入调查。
7512,东莞取消22项非行政许可审批事项，33项行政审批调整为政府内部审批，专家称此举有利于压缩权力寻租的空间；专家：此举在助推政府简政放权同时，有利。
7513,网曝连云港一城管上班时间在肯德基玩手机，有3天每天都能看到对方；网友称其其实是一名协管员，称已意识到错误，会立即改正(图)
7514,"侯马7岁男童舍己救人导致大脑受伤，坚持傻子雷锋，被学校称为傻雷锋""；其家人称其为其监护人支付3000元；该学校向学生支付5000元，称为傻子锋"
7515,"""[拌饭]柯震东吸毒后欲复出,留新发型出席公益活动(图);张柏芝想再婚曝小儿子爱撒娇;顾长卫蒋雯丽再传;顾家卫蒋雁丽再曝;顾短卫蒋琬丽再傳。"""
7516,成都：女子驾车前往三圣乡途中，因行驶变道原因在娇子立交被驾车逼停，遭殴打致伤；警方公布案情：两次斗车开窗互相喊话，疑似斗气，现已对外公布。
7517,杭州千年古刹灵隐寺首座继云长老昨日在灵隐院示寂，享年92岁；原市政协委员，原浙江省佛协常委，原杭州市政府委员
7518,加拿大前省委书记程维高之子程慕阳曾任《卑诗省报》、《卑詩省》等媒体勾画商业帝国，曾任河北《省委委记、《加州中环一样的金融和商务中心(组图)
7519,哈尔滨：今日14时许，哈牡高速动物园路段一客车与一辆轿车相撞，致5人遇难，事故造成5人死亡
7520,昨晚，杭州临安天目山镇一名游客被山洪冲走下落不明，目前已找到一名失踪女子，其中一人为昆山，丈夫刘伟军和妻子均已遇难；事发时两名昆山游客，两人均已
7521,濮阳一派出所民警带孩子上班群众放一边办事群众执政为民、争创一流等字样，称门难进，事难办，脸难看；警方暗访暗访称执行为民，争创1流。
7522,百度文学发声明称，从未与腾讯文学、阅文集团接触并谈判投资议题，网上相关新闻严重失实；此前有媒体报道称百度将要出售，目前接洽方正是阅文团团，预计双
7523,一季度全国31个省(市、自治区)生产总值近日已全部出炉，18个地区增速跑赢全国，辽宁仅1.9%，江苏、吉林均为全国第一；江苏第一
7524,杭州：24岁女子出电梯时，电梯急速下降，头被夹在电梯里，抢救无效身亡；目击者称，女子想出电车时，急速降降，被困女子已无生命体征。
7525,漳州：今晨4时40分许，漳州3辆货车连环相撞，1人被困，事故现场无大碍，司机被抬上车底，消防官兵爬入车底将货车吊起；事故时货车载物较重，千斤顶与起
7526,"北京朝阳区一幼儿园7例手足口病事发，事发二十一世纪金茂府双语幼儿班共7名孩子患手足病，暂不确定是否在园区内传染；园方称幼儿已进行消毒和隔离。"""
7527,西安：小学教导主任因陪酒致死，当事教育局副局长被停职；当事学校教育长称其喝醉后回家倒床便睡，未醒来；教师回忆丈夫喝醉酒回家后倒床就睡未醒(图)
7528,英国水下生活枯燥寂寞，英国青年愿报名入伍当海军，英军青年越来越少，因为水下活活枯寞，愿报军入伍；英国潜艇兵出海后，下一次水就呆90天不可能的事。
7529,宁波：男子网购苹果手机被有心人冒领，送货路上被人截走，快递员称快件已被骗走，警方抓获；该男子在上海、衢州等地发生多起订购的案件，已被抓获。
7530,广东：全国首例输入性确诊病例密切接触者已追踪至67人，仍有10人失联；韩媒报道，韩国确诊患者已达18人，拟禁止接觸者出境，韩媒称此病有持续社区传
7531,组图：中国人在日本奈良围住小鹿割鹿角，目击者称鹿角是自己断的，事发时鹿角淌着血，流出血，断成一截；事发地是粤语，目睹者称鹿茸是自身断裂。
7532,春晚总导演哈文：好节目是硬道理，要有国际大奖的；对于老中青艺人和基层身怀绝技的演员，坚持以艺术为首要标准，公平公正地选拔演员。
7533,网曝超级低俗屠夫被江西公安机关行政拘留，自称行为艺术，实为逐臭苍蝇，到处飞来飞去唯恐天下不乱；曾在网上辱骂他人、扬言设灵堂等劣迹不同
7534,咸阳：男子步行上高速被骗到黑砖窑，逃跑后沿312国道流浪，一个月走到咸阳；警方称其去新疆打工时被骗至黑砖窯，逃走后走咸阳，目前已将其送往救助站(图
7535,俄外交部副部长表示，伊核问题最终协议的制定工作取得进展，六国与伊朗政治司长暂时没有会晤，本周将在专家级别举行会谈。
7536,网传赣州一副镇长与多名女子开房裸照，两女子被纪委停职；官员回应称纪委已对涉事镇长作出停职处理，目前该案正处于调查阶段，纪委正在调查中(图)
7537,东莞政协委员刘伯权曾驾驶直升机抓贼，称嫉恶如仇，抓贼源自本能；曾因组织小姐阅兵事件走红网络，5年前驾驶保时捷狂追三公里，被撤销政协员员资格
7538,重庆：6岁孙子乘坐摩的准备去儿童医院，半路摩的师傅担心查超载，下车步行至约定位置，摩的和孙子未出现，摩托车未上车；摩的司机无运营资质无人看管。
7539,承德交通运输局副局长范有毅涉嫌违纪违法，接受组织调查，日前，市纪委已将其涉嫌犯罪问题及线索移交司法机关处理。
7540,白城市发布雷电黄色预警：预计未来12小时我市部分地方将出现雷电天气，局部地方伴有短时强降水、雷雨大风或冰雹天气...
7541,疯狂英语创始人李阳与前妻李金再次因财产纠纷引发诉讼，起诉支付400万售房款，其妹要求限期迁出位于东三环紫荆豪庭的一套房，同时支付房屋使用费
7542,组图：张家口首台被称为雾炮的抑尘车上岗打雾霾，该多功能抑塵车携带可向空中发射水雾的喷洒系统，能将水雾喷洒100米远、60米高，达到快速抑制灰尘的目
7543,美国一对明星夫妻宣布离婚，又一对好莱坞模范夫妻就此劳燕分飞；这是一对美国音乐界最知名的一对夫妻，两人都是真实的人，有着沉重心情决定分手(图)
7544,榆林：9个月身孕女子与家人超市购物时被捅成重伤，警方将其当场抓获；目前该男子已被抓获，并持刀将其捅伤；其母亲抢救生命危险仍在抢救中。
7545,大连市发布道路结冰黄色预警：预计8日傍晚到9日早晨，大连、金州区、旅顺口区由于积雪出现道路.冰，将对交通有影响。请注意防范。...
7546,南通：女生为读大学每天8次奔波，每天往返家与学校间8次，每次往返于学校八次，称等我读了大学找到工作，不用这么跑了；父亲称等读了工作就不用
7547,沪深两市开盘涨跌不一，券商、煤炭、保险、军工改制等权重板块带动下，再度站上3000点关口，创业板低开冲高回落之后低位窄幅震荡，深成指低开震荡走高
7548,：吉林主场121-108轻取浙江队，收获两连胜；马丹利因签证问题未出战，因签證问题无法出战；马连利因为签证未题出战
7549,日本人平均寿命为84岁，蝉联全球第一；与1990年相比，男女的寿命均延长了6岁，与1991年同比，西非国家塞拉利昂均为71岁。
7550,安徽寿县一大学生村官陪酒致死，鉴定所长称血液酒精浓度超醉驾标准，血精含量未达0.8788mg/ml，死者家属不原谅；鉴定结果显示，血液含量超酒驾。
7551,朝鲜在半岛西部海域北方界线的朝方一侧开始海上射击演练，一枚海岸炮落入韩方一则，韩军开炮回击，韩方开火回击；韩军称，若朝军向北韩界线以南。
7552,普安县一2岁男童掉进洗衣机，被甩干桶卡住险被当衣服甩干，消防官兵及时救出；疑因不懂得调整位置，下肢轻微擦伤无碍；消防员及时赶到将其救出(图)
7553,洛阳一男子家中死亡9年后被发现，尸体从2006年之后就没有联系，家属称其尸体与前妻离异，女儿跟前妻过，没有来往；居委会回应称该小区电路严重老化(图)
7554,海南天价土豪车牌拍出110万，高价创海南新高，知情人称该车牌号拍出百万创海北新高；知情者称拍走该副天价车牌的为三亚某房地产经纪公司，并成为标王
7555,组图：南阳一男子在大庭广众之下清洗充气娃娃，面对市民异样眼光，淡定从容；网友吐槽新版秀恩爱；有网友对该男子扬言用充气这不是你的错。网友
7556,暴风科技晚间公告称，公司正在筹划重大事项，股票自6月11日开市起停牌；此前暴风魔镜宣布与天音、爱施德合建线下体验店，与触控科技、游族影业、星美文
7557,印度总理莫迪发出第一条微博和中国网友互动，称你好中国！；此前已有4个国家领导人开通微博，并提出修改意见；印度第一位在微博开通账号的高级官员
7558,反课纲团体占据台湾教育部前庭，学生代表宣布即刻退场，结束长达162小时的抗争；学生抗议即时退场，并撤回微调课纲，要求教师下台(组图)
7559,今日上午，天安门地区及长安街沿线举行全要素阅兵预演，空中梯队规模将创历史之最，参与飞机数量也将创下历史最最；空中护旗方队将以前所未有的亮点
7560,印度南部浴河节活动引发踩踏事故，造成至少27人死亡，另有数十人受伤；事发地点位于戈达维利河畔，有一朝圣者赶往河边时鞋子掉落，致造成27人遇难。
7561,十堰：监利县一警察下班期间制止数人斗殴，徒手与持刀歹徒搏斗被捅16刀因公殉职；据悉，该男子持刀男子气焰嚣张，围观群众被威胁，目前已送医抢救无效。
7562,眉山：48岁女精神病人入敬老院怀孕27周，亲属直指在敬院可能遭遇强奸或诱奸；事发仁寿县四公镇，官方已对其展开关爱行动，目前已被免职并暂停工作(图)
7563,中国中车今晚公告，下属全资子公司南车香港拟认购中国置业投资控股有限公司，将认购一中国投资约60%的经扩大已发行股本。
7564,重庆力帆官方宣布签约新外援维埃拉，据悉其在巴甲球队利斯菲体育会俱乐部
7565,组图：俄罗斯游过黑龙江游过中国，被称为总统之虎的库贾，系俄罗纪第一只游过东北江到达中国的俄国老虎，系本世纪首只游历黑龙滨到达俄国的老虎
7566,克里米亚半岛符合征兵年龄的年轻人将首次被划入俄联邦军队序列，而不是乌克兰；俄国防部称，俄武装力量将在克米米亚补充约500名士兵，预计这些士兵将在在克
7567,深圳一交警在车上签名操你妈，被拘10天；因公然侮辱警察被行政拘留10天。
7568,淄博姑娘自爆在济乘出租车时失失2万元爱心款，称曾受地瓜妹启发卖鸭脖募捐，自曝曾在泉城广场身穿婚纱举牌征婚救哥哥，被称婚纱妹(图)
7569,何炅微博晒出自拍照，戴墨镜酷劲十足，网友猜测何炅已经结婚了，有网友喊话该结婚啊何老师(图)
7570,乌海一煤气管道发生泄漏，起火燃烧，幸无人员伤亡及次生事故，事故原因正在调查中。
7571,外交部：中国中海油981钻井平台作业是民事活动，由于越方持续强力非法干扰，中方派出政府公务船在现场进行安全保障；中方已多次表明立场。
7572,媒体揭郑少秋私下惧内，与前妻私下怕内，称只知与前夫私下钱只剩26元；自称与前丈夫离婚，赚进约550万；曾称不知道也差不多啦；自己一度穷到户头只剩
7573,印度公务员考试难度远未平息风波：印度英语成绩将不计入总分，2011年考生可在2015年获得第二次考试机会，但不能再选择印地语作为考试语言，但并不能实现诉求
7574,湖南魔术师杨张建赴娄底演出后下落不明，其间与家人通话称摔断腿要家人打4万元过去，家属照办后彻底失联，至少9人被骗，其中6人已找到，6人逃脱
7575,厦门：74岁老人大堂摔倒，责怪物业公司铺的塑料纸太滑没有任何提醒，诉状告物业，称物业承担安全提示，要怪行人注意和采取安全防范措施，已被物业起诉。
7576,长沙：国企退休干部豪饮20年喝下3吨白酒，超三分之一喝下1吨白糖，医生称超三成之一的公务员已成为该病主力军；医生表示超3分之1的酒精引发其病史。
7577,"""[拌饭]韦德1年2000万续约热火;利拉德正式续约一人坚守波特兰;门罗3年5000万加盟雄鹿尼克斯湖人,湖人又打水漂;邓肯亲承不会退役,下赛季肯定在场上"
7578,安徽绩溪一纪检组长被妻子肢解并肢解，警方证实死者妻子并未承认是凶手；目前警方还在寻找死者被肢解的部分遗体，暂时还不能确定死因。
7579,成都第一家铁人三项俱乐部创始人失联4天，网上发起全城寻车攻势，警方已介入调查
7580,石家庄一对夫妻吃隔夜虾爬子、草莓及西红柿，致2人不治身亡，医生称两人均为隔夜菜惹的祸，疑为隔日菜惹祸，夫妻二人均系隔夜蔬惹的灾，疑因隔夜食物。
7581,内蒙古银行副行长延城涉嫌受贿被逮捕，这是内蒙银行七个月以来被查的第三位厅级干部。
7582,组图：南京一对夫妻一夜成千万富翁，体验秒变一夜变千万元富翁；13.55亿奖池和0.99亿派奖奖金静候本周六新一期，13.55亿派金奖金正在继续。
7583,数字媒体巨头收购了科技博客网站/code，该网站由知名科技记者莫斯伯格和卡拉·斯韦什创建，该公司财务细节并未公布，媒体称交易完全以股票形式完成
7584,阜阳一男子患上良性肿瘤，术后双目逐渐失明，双目渐渐失失，术前一年双目几乎失明；医生称其左眼完全失明、性功能丧失；术后视力下降性功夫丧失(组图)
7585,宜宾市发布高温橙色预警：受大陆暖高压影响，我县的中东部乡镇未来24小时内将出现35℃及以上的高温天气。请有关单位和人员作好防暑降温准备。请...
7586,我国发布全球首台人脸识别功能的机，已经通过验收，将与银行和公安系统联网，持卡人只能从银行卡取钱，并需要验证人脸，其他人的银行也无法取钱(图)
7587,天津师范大学一大三阳女生宿舍烧炭自杀，疑因乙肝病毒携带者被安排进宿舍，母亲称其母亲不愿意上一早英语课；母亲担心女儿生命危险，不愿上学(图)
7588,证监会：近期一些不法分子捏造、散布虚假信息，严重扰乱资本市场秩序，甚至引发股指大幅波动，已关注到了近期资金市场的一些谣言，已经关注了了这些事件
7589,宁波2号线一期全面进入列车调试阶段，地下段已经全线调试，高架段已到了高速列车和自动驾驶调试階段；去年3月，1号线全线轨通。
7590,东莞：老伯擦身而过撞人救人各执一词，判赔28万；法院认定两车存在相撞，双方各负一半责任，因公平原则各负1半，小伙因事故受伤，判罚28万
7591,焦作市发布雷电黄色预警：预计今天下午全市大部分地区将出现雷电活动，局地伴有大风、短时强降水等对流性天气，请注意防范！...
7592,《中国连锁》杂志报道称黄光裕有望今年出狱，并称国美近年无战略失误。国美电器午盘拉升，国美股价涨14.29%报2.24港元。截止发稿时，国内电器涨14.29
7593,沧州市发布大雾黄色预警：目前沧州及西部地区出现大雾天气，部分地区能见度不足300米，预计未来三小时，该地区大雾仍将持续，请防范...
7594,组图：姚明从休斯顿火箭队退役，并收购上海男篮，成为上海大鲨鱼篮球俱乐部老板，收购男篮篮球事业，继续自己的篮球生业；姚明与交往11年，女儿姚沁蕾。
7595,厦门第二西通道已于6月10日获发改委立项，总投资57.05亿元，将有效缓解出入厦门岛的交通压力，为海沧大桥减负
7596,香港股市今日仅29只股票上涨，恒生指数收跌3.18%，报25236.279点，国企指数跌2.99%，红筹收跌2.99%报12231.431点；红筹指数涨4.89%报4541.
7597,外媒称中国商用飞机今年不会进行首飞，但因组装所需时间比预期要长，令首飞计划推迟。
7598,凉茶红罐纠纷案今日上午，最高法将审理，广药公司与王老吉公司、广州医药集团、广药、医药等公司共同使用其红罐，涉嫌使用知名商品特有包装、装潢纠纷。
7599,绵阳：12岁女童因中毒身亡，经抢救无效死亡；直播绵阳一小学六年级女生喝农药，因中暑身亡；事发时正在上学，老师请假，因疑似中毒，致其中毒昏迷(图)
7600,组图：济南街头现车窗抛物不文明现象：部分驾驶员随手将垃圾从车窗丢出，垃圾多为烟头、水果皮、小广告等，被处罚款50元、记2分；公交站牌附近现购物袋
7601,组图：国产歼战机照曝光，系苏式战机基础上发展了多型战机，已发展多型机型，已有型号曝光。
7602,合肥肥西5岁男童在家门口失踪，遗体在其隔壁堂奶奶家中发现，事发后其服农药仍在医院救治；事发前其服医药仍服农薬，事后服农葯仍在治治，一无所获图)
7603,"""铜仁市发布冰雹橙色预警：预计我市中部以东地区未来6小时内可能出现冰雹天气，并可能造成雹灾（同时还会伴有雷电、大风天气）,请做好相关防范..."""
7604,烟台人大常委会第一副主任李淑芹任人大代表，曾任烟台市人大主任
7605,组图：惠州东江河底发现数十吨乌木，4根出水木头已腐烂掉，40根完整；警方称该批木头属于无主之物；疑似乌木归属谁，疑为樟树木种，已被暂扣暂扣。
