0,龙岩市发布暴雨橙色预警：我市新罗、永定、上杭部分乡镇已出现大雨到暴雨，预计未来3小时我市部分仍有较强降水，请注意防范山体滑坡、洪涝、泥石流、城市
1,郑州：女子试吃哈密瓜被丈夫掀翻，掀翻人家水果摊将其打伤；丈夫为报仇跑到超市，为报复妻子报仇，为其报仇为其打死；女子因涉嫌寻衅滋事罪被刑事拘留。
2,组图：一颗小行星将接近地球，核心含一亿吨白金，价值高达3.5万亿美元，已有采矿公司将这颗小陨星列为勘探对象。
3,信阳：11岁男孩喉部肿痛在诊所割喉失血休克死亡，当事大夫已经逃跑；当事人夫已逃跑。
4,组图：福州80后爸爸黄川将被推入手术室，安慰妻子进去睡一觉就出来。
5,长春：20岁男生骑单车回家，途经19个城市，行程2300多公里，骑行跨越7省，途径19城，途程2300公里；称想看看美丽的世界，得到很多好心人帮助，绝不能放弃
6,宿迁：蒙面男闯银楼抡锤砸碎柜台玻璃，抓起一把黄金项链后逃窜，抓一把项链就跑；警方抓获赃物悉数追回；该男子在睡梦中被抓获，目前赃物全部追回(图)
7,亚篮网消息，浙江广厦男篮已和29岁美国球员杰里米·帕戈签约，场均得到3.1分1.3个篮板，1.3助攻
8,陇南市发布雷电黄色预警：宕昌、礼县西部出现强回波，预计未来6小时，我市北部部分地方将出现雷电、短时强降水、阵性大风及局地...
9,因原油供应过剩局面进一步加剧，美国原油价格本周连续刷新6年新低，原油期货价格周三暴跌4.3%，每桶收报40.80美元，创以来最低结算价格。
10,英国99岁老妇收到医院来信要求携带尿液到院进行产检，信中的名字和出生年月日皆正确，称自己已经99岁，并强调自己有3名子女、7个孙子以及13个曾孙。
11,网络红包税将开征，税务机构酝酿对网络紅包征税，税务总局称取得企业红包才需缴税；取得红包须缴税，取得税款须缴纳税款，并非企业销售商所用。
12,组图：昭通破获一起猎杀大熊猫案，抓获10名嫌疑人，查获熊猫皮一张，9.75公斤、腿骨2根、头骨2块、熊胆1只；被猎杀熊猫肉9.75公吨、腿部2根，头骨
13,连云港海州区卫生监督所副所长李万银用公款购买超市购物卡，涉及走访有关单位及发放单位职工福利。
14,连云港一国土所建豪华办公楼，多圈进去2倍，村民称名不虚传；官方回应：国土局已介入调查，并称不排除办公；媒体称国土部门介入查处，并不会更换。
15,毕节留守姐弟遇害，警方悬赏10万通缉凶手，凶手系同族亲戚；两人去年曾遭邻居老汉强奸，闹得村里人尽皆知；当地人称女孩去年被邻居强暴，闹的村尽皆晓。
16,中国建筑控股股东中建总公司今日增持公司股份1350万股，总股本为168.59亿股；目前中建公司持有中建建筑的股份数量为168.59亿元，占公司总股份的56.2%；目
17,随州市发布大雾橙色预警：目前我市大部地区已经出现能见度不足200米的大雾并将持续，请注意防范。...
18,中建置地拟配售1亿可换股债券，初步换股价为每股0.05元，较昨日收市价0.043元溢价16.28%，若悉数兑换将发行20亿股新股，溢价18%；若悉數兑换，将
19,西安：男子半夜搭讪情侣要钱买烟，被劫匪拦下狂追，持刀将其推倒身亡；劫匪趁机狂追劫匪两条街，最终将其制伏；劫贼高呼抢劫了，最后被其制服(图)
20,委内瑞拉副总统马杜罗今日下午在军事医院宣布，查韦斯去世，其患癌症很可能是美国发动的科技攻击引起的，政府将成立专门科学委员会调查其病因(图)
21,加拿大难民局：程因可能在加国境外犯有严重罪行，难民申请被拒，被媒体视作中国外逃贪官程慕阳的最新证据；此前加中没有引渡条约，即便加中无引渡中国
22,云南26条高速路16日起将调高收费标准，因经营困难、发展困难等，公路亏损严重；目前在建的高速公路平均每公里造价达1.2亿，拟建高速经营亏损达8%。
23,巴萨当家球星的哥哥马蒂亚斯-梅西再次因为发推嘲讽罗而被推到舆论风口浪尖上，上周发推讽，被推上舆论浪尖；上周他刚刚通过一张罗奖杯对比图奚落葡
24,组图：瓦房店火车站附近一女子用拳连续击打母亲头部，母亲瘫坐在地哭泣；事发时20岁左右，身穿运动裤，可能为学生，事发前女子20岁右右身穿運动裤可能是学
25,杭州：产后抑郁，端热油锅泼向熟睡丈夫，妻子被判无期赔180万；丈夫因产后精神状态不好，丈夫被判180万，因怀孕后与女儿不够关心，丈子获刑180万赔180余元。
26,郑州：男子恋上网吧失联3个月后，手、脚肿胀，被诊断为严重肺结核，病灶已吞噬大部分的肺；医生称其花10万还没治好；曾因网吧上网遭患者殴打致肺肿胀。
27,受桂江上游、柳江支流东小江水位持续上涨，桂江兴安至阳朔河段等河段将出现超警戒水位洪水，桂林市区河段超警1m左右，为今年首次超警。
28,京东出售情趣护士装引各界人士抵制抗议，称靠污辱全体护士来卖这些东西，引发医疗界人员抗议；此前京东在自己网站出售护士，引各方人士纷纷抵制(组图)
29,阿富汗超100名儿童和成人因仿制冲锋枪和其他玩具枪受伤，政府已下令禁止玩具槍买卖，目前已有100多名儿子因玩具被打伤，目击者称其中有100名受伤者被打死。
30,九江市发布雷电黄色预警：九江地区未来6小时内有雷电活动，局地伴有短时强降水等强对流天气，请注意防范。...
31,东风汽车今日发公告澄清，称董事会并未研究相关合并事宜，目前也无任何应披露而未披露的资讯；今日下午复牌，截止发稿，下跌0.6%，报12.98港元。
32,外交部长王毅：中国愿帮助几建立自主工业、粮食安全、公共卫生防控三个发展体系，解决就业、吃饭、健康三个民生问题。王毅称，中国将帮助其建立公共衛生防
33,刘谦否认与富家千金王希怡领证且女方已怀孕，并澄清女方未怀孕；刘谦经纪人否认此事，称其系国内著名厉家菜第3代传人，其家族在全球拥有多家厉家厨餐厅，
34,中石化两条管道被令停止输油，安监总局暗查暗访发现重大安全隐患，中石油对两条原油管道下达停止輸油指令，中国油化集团公司原油公司安全隱患严重。
35,国务院发文要求，鼓励民营银行试点，鼓动民营资本发起设立中小型银行等金融机构，并推动民间资本投资设立银行，提高审批效率，并鼓励个人发起建立中银行
36,希腊总理齐普拉斯致信称，希腊没有向国际货币基金组织按时偿还债务，致该国成为史上首个发生债务违约的发达经济体，希望赢得津巴布韦、苏丹等违约国。
37,滁州市原市委书记江山等3名厅级干部被检察机关查办，案件侦查工作正在进行中。
38,台媒称，纽约摩天轮将建成全球最大的摩天輪之一，将建设商场、酒店及餐馆；开发商决定向希望获得绿卡的中国人筹款。
39,第25轮：辽宁主场44分比斯利独木难支，哈德森30+6辽宁取得2连胜
40,业内人士称，国企改革指导意见有望在一两个月内下发，改革改革顶层设计方案发布后，央企有望全面铺开。改革与创新为行情主线5000点之上，市场宽幅震荡
41,昆明明通小学踩踏事故案一审判决：致6死35伤的明通学校校长李岚、副校长杨霖、体育教师李鹏程犯教育设施重大安全事故罪，分别被判2年至1年不同刑期。
42,南京最牛公交线路东上线全程71公里，全程74公里；全程72公里全程73公里
43,奥巴马称，美国主导的国际联盟打击伊斯兰国组织的军事行动取得成效，但彻底摧毁这一极端恐怖组织仍需时日；在叙利亚，他们丢了包括塔尔比亚在内的重
44,临沧市委书记李小平涉嫌严重违纪，目前正接受组织调查。
45,武汉高校食堂十大便宜招牌菜出炉：华中师大、中南民大等高校改造或建新食堂，学生盛赞潮州烧鹅饭，学校称其母校味道，称母亲的味道(图)
46,媒体称长沙房价中部省会中倒数第二，平均价格6867元/平方米，仅高于太原6639元；其中株洲样本微涨0.82%，仅低于太塬；长沙环比上涨，24城环比下跌。
47,辽宁省发布道路结冰黄色预警：预计26日下午至27日早晨：沈阳、鞍山、本溪、锦州、阜新、辽阳、铁岭、盘锦地区以及凌源市、喀左县将出现对交通有影响的道路
48,足协副主席谢亚龙因贪腐入狱狱中获6次表扬，曾任中国足协主席；曾任足协原主席，曾在中国国家足协董事长；其曾在足协理事长、南勇、陆俊等人均获减刑。
49,中国乒联公开赛：中国队成功包揽四项冠军，马龙4-1力克许昕，朱雨玲横扫丁宁，女单冠军分别属于樊振东/许昕和女单封后，男双和女双的冠军属于刘诗雯
50,信阳市发布暴雨黄色预警：河区、罗山、光山、新县、潢川降雨量已达50毫米以上并将持续，平桥区、息县、淮滨未来6小时...
51,青岛今起放开住房限购政策，首周新房成交2014套，环比增加6%，市场反应较为积极；8月新房交易量大升，主城区和远郊均有新盘入市；9月岛城市已有33盘。
52,组图：金华一协警在金华救七八岁落水男童，自述救人经过，泡坏一只手机救人，称为立功后可转正成正式的交警；村民三缄其口，自称见义勇为。
53,韩国前总统金大中遗孀李姬镐女士最早可能在下月访问朝鲜，并可能将与朝鲜最高领导人金正恩会面。
54,深圳一民办学校6层高建筑消失，校长称目击以为学校起火了，目击者称发现该建筑已经封闭停用，未有人员伤亡；校方称目击是学校科教楼(图)
55,聊城人大常委会第一副主任王改真昨日在东昌湖水中发现一具女尸，警方已排除他杀，系溺水死亡，死亡原因正在调查中。
56,东莞7名初中生结伴游玩，不慎掉入江中，另2名男生救起后溺亡，其中一名学生因体力不支也沉入江里；另一男生在附近钓鱼时救起，另一人救起2名落水学生
57,中国作协首位女性主席铁凝被授予法国文学与艺术骑士勋章，该女主席曾两次摘得鲁迅文学奖，并被翻译成英、法、德等文字；该作品曾被译成鲁迅作学奖(图)
58,渭南华县一村支书带20人暴打一村民，两年前与十多名村民联名举报贪腐，目前被打者包括其儿子；知情人称其与其他十多人举报，伤情暂不明；涉事村民被停职
59,辽足主场与恒大之战后，郜林在球场通道处受到球迷辱骂，并将球鞋扔向骂人的球迷
60,中国在建的第一高楼、苏州729米的超高层中南中心项目被传停工，工地被塑料围墙围起，工人身影不明；媒体称项目很长时间一直处于这种状态(图)
61,27省区出台统一养老保险实施办法，居民养老金省际差距最高达10倍，专家称应建立城乡居民基本养老险正常调整机制，养老费用最高可达10元，最高最高10元。
62,审计署发布2014年审计公告：中电投下属企业花1753.66万买高档烟酒，称是会议费；中电下属公司花1433.54万买低档酒；中粮高管购高档酒，未付全款就办交接手
63,组图：广州顺产男婴今日出生，体内长出一双手和双脚的连体男婴，手术很成功，寄生部位已全部移除；医生称其系正常四肢，其中一双脚和双手外还长出双手。
64,韩媒称传金正恩妹妹金与正已经结婚，其夫或成为朝鲜政权核心人物，也有传闻称其与正的丈夫是护卫司令部所属护卫军官；传闻金正正丈夫为护卫公司所属人物
65,江苏一女生写出烧脑作文获北大哲学专业录取，高考中考出400分；曾被北大严格自主招生笔试面试，获得降分到本一线录取资格；高考时曾被高考录取(图)
66,青岛城阳区一名失踪男孩失踪，身高130cm，右下巴有一处伤疤，右上巴有疤痕，左下巴疤痕如有线索请报警
67,开封一女子做子宫肌瘤切除手术，术后感染艾滋，血站称不排除有艾滋病人在窗口期献血，此阶段病毒无法检测；血站改口说不排斥有艾病病人窗口时献血。血站回
68,国家流行病学调查显示，儿童性发育时间从原先的11至12岁开始发育，提前到女孩平均9.7岁，男孩均均11.3岁；专家称这是比较新的数据，是较新数据。
69,昭通：被埋44小时的八旬老人熊正芬被救出，身体状况良好，无受伤情况，由于长时间未补充食物，血糖较低身体虚弱，现在血糖不低，体糖较高身体虛弱(图)
70,世锦赛女子50米仰泳傅园慧夺冠，为中国游泳队拿下女子项目本届第一金，为其获得的第一项世界大赛冠军(图)
71,陇南康县两副乡长虚报征地补偿费，被检方批捕，涉嫌贪污罪被批捕。
72,组图：海军男初级士官正式换着水兵服，原配发的海军士官大檐帽、春秋常服、冬常服和长袖夏常服停止穿用。
73,酷派集团公布，向奇虎360旗下的转让90股股份，占其已发行股份的4.5%，约合人民币2.8亿元。
74,组图：网曝西工大长安校区流浪狗集中屠杀，校方回应称系虚假信息，只是一次合理的捕获流浪犬行动，并不是屠杀；涉事校方称只是合理捕获，并非屠杀。
75,车王舒马赫苏醒后苏醒仅能活几个月，或成植物人，媒体称其苏醒却只能活数个月最长几年，或者一直成植人人；官方称其死亡原因不明
76,邯郸永年县一警察酒后驾车撞倒3名学生致2死1伤，事发时警察与同学撞人致两死一伤；家属称肇事警察驾驶无牌套牌、走私豪华摩托车，涉嫌逃逸见死不救。
77,通化市发布雷电黄色预警：目前我市已产生雷电天气，未来12小时内通化县（县）局部地方伴有短时强降水或冰雹等强对流天气...
78,组图：江宁区一排水站下午发生沼气泄露爆炸，目击者称两工人在沼气罐子上面电焊，不知怎么回事，突然爆炸。
79,南通崇川一小学一名男性教师猥亵数名女学生，知情人称系班主任，十几个学生去派出所做笔录；知情者称该老师曾在派出去做笔记，涉事老师已被带走调查
80,美国著名汉学家、华人学者钱存训在芝加哥去世，享年105岁；去世前，钱存訓为美国芝加大大学东亚语言文化系荣誉教授、约瑟夫•雷根斯坦东亚收藏馆名誉馆长
81,消息人士称，在一周之前就已与深交所会面并了解进度，一切都已照计划顺利推进，进度可能会比外界预料的还快，深港通9月或10月中旬正式开通。
82,咸阳一医院行贿260万元行贿10万，已立案14件15人，涉及3个市7家医院正副院长8人，其中大要案13件14人，已对10名嫌疑人依法批捕；检方经侦查，共立案。
83,衢州：17岁男生因女同学恋爱，每天想如何向女神表白，被其拒绝后跳楼跳下身亡；因心理问题无法承受，被拒绝；目击同学称其悲壮一跳后身亡(图)
84,安康一对夫妻家中电视机突然爆炸，留守家中的婆孙两人瞬间倒地，警方调查发现电视故障引发，婆孙二人瞬时倒地；夫妻道出实情或因与邻居妻子通奸遭报复。
85,滴滴打车安卓版今日开始支持支付宝付款，首批济南地区已经可以体验。预计本月底，全国滴滴用户可以在滴滴上使用支付。这也是快的滴滴合并后，双方在业务上
86,安阳钢铁拟以1.96元/股向控股股东安钢发行股份购买舞阳矿业100%股权，总计作价22.47亿；据悉，公司股票自6月10日下午13:00起连续停牌，并于6月11日
87,郑州：2岁半女童被遗忘车内，未等来属于她的快乐六一；因家人疏忽，2岁女童大夫、大夫，快救救孩子；医生称其心跳为0，血压测不到浑身僵硬。
88,组图：乐清发生一起灭门惨案，男子杀害妻子与老丈人，将16岁女儿捅成重伤，目前仍在动手术，未脱离生命危险。
89,万达集团官方宣布，与三家机构及盈方管理层，共同并购瑞士盈方体育传媒100%股权，其中万达控股68.2%。
90,组图：泰国媒体称少林寺代表团下榻的湄南酒店确认释永福大师未能随团如期抵达曼谷，媒体在少林团下午确认少林僧方丈释永信未随团抵泰；今早少林代表團下榻
91,韩媒：一名朝鲜军人越过韩朝军事分界线来到非军事区（），表示希望归顺韩国，此前朝朝双方紧张气氛一度升级，未发生武力冲突。
92,新中国开国大典总指挥罗浪在北京逝世，享年95岁；其创作的《哀乐》创作者罗浪今日在八宝山兰亭礼堂举行追悼会上用《哀歌》为自己最后生命送行（图）
93,古巴一男子欲在裤子内藏66只小鸟，因裆部太突出被当场识破，被警方逮捕；该男子裆部隆起特殊引起海关人员注意，警方表示男子在裆部凸起，被抓时裤子被封住
94,济宁邹城一初二女生被同年级女生殴打，跪在地上自扇耳光长达一小时，校长承认有监管责任，承认负责责任
95,中国农业发展银行安庆市分行原行长储桂生因受贿49万余元，并挪用公款10万，一审获刑12年；其挪用10万元款项退赔发还给单位。
96,组图：唐山501吨重神龟今日落成，耗资2300万元，耗时2300万，将成京津冀旅游文化新地标；该潭占地200亩，总投资2200万元人民币，为京津海区域旅游新地。
97,北京东城区检察院以郭美美、赵晓来涉嫌开设赌场罪，提起公诉，起诉书指控其多次组织他人进行赌博活动，情节严重，应当追究刑事责任。
98,厦门白城、珍珠湾海滩现海漂垃圾，大部分是水浮莲、木头、竹子、杂草，还发现25头死猪、1条死狗；环卫处判断是最近强降雨后上游泄洪所致，海卫处或是强降
99,辽宁：考生忘带身份证可刷脸进考场，治疗时间最多可延长30分钟；如无特殊情况，考生离开考场时必须交卷，并禁止再入考场继续考试，考试时间不超30分
100,西双版纳傣族自治州发现旅游协会违规审批企业经营权，收取费用，让本是市场经营者的旅游客运汽车公司员工监督旅游市场，旅营者，旅游大巴乱象购物返佣金，
101,达州区原副区长刘庭瑜涉嫌收受礼金32.8万元，被公安民警当场抓获；其与3人携带较大赌资在酒店打5000元起注的成都麻将，涉案金额最多为电力集团原董事长
102,矢野浩二澄清不上《天天向上》并非受国家关系影响，称想将更多的人物形象展现给观众；此前有传闻称汪涵送给汪涵一枚天天兄弟荣誉戒指，此前汪涵赠其一枚戒
103,茂名：英德两村民每年一淹就是一层楼高的水，政府提出的搬迁计划一拖再拖，每年水淹我都哭；政府回应搬迁问题一拖又拖，两村每年搬迁难题就是不解决。
104,许昌出现第一把火的乡镇，将在新闻媒体上曝光，并在全市范围内通报批评，取消当年评先资格；县(区)、乡、办)等乡镇处罚10万元，并取消评后资格。
105,李炳军、胡幼桃辞去江西副省长职务的请求，李炳軍任赣州市委委员，李幼桃任赣南市委书记
106,陕西房姐龚爱爱伪造、买卖国家机关证件案一审宣判，被告人不服一审判决提起上诉；其系陕西靖边县农行原副行长，因在北京、西安等地拥有多处房产被注销。
107,山西最年轻首富李兆会迎娶明星车晓，婚礼造价500万，曾在北京请来的婚庆公司布置婚礼总共造价5亿元；媒体称其家族内斗及离位，遭银行上门讨债(图)
108,经济学人智库发布全球宜居城市排名报告，香港排名46，是中国最靠前的城市，北京位列第69位，蝉联中国大陆最宜居市市；天津和苏州分列第二、三位
109,黔南布依族苗族自治州发布暴雨红色预警：根据最新监测资料分析，目前我州部分乡镇降水量已达100mm，预计未来3小时大部分达100m...
110,上交所今日发布公告，因技术原因，上证期权合约于7日下午2点恢复交易，9时56分相应停牌，具体恢复时间另行通知。
111,财政部部长楼继伟：简单地提高起征点做法不公平，不能体现每个家庭的差异，下一步要把分项征收改成综合所得税。
112,平顶山：宝丰县委书记刘书锋涉嫌受贿犯罪，被立案侦查，并采取强制措施。
113,长城汽车现价大涨9.31%，报60.45港元；股现价58.98元人民币，上升5.81%。
114,中国网络媒体论坛在湛江召开，汪文斌发表演讲，称一带一路，网络先行，中央网站第一次到湛江，与湛江网友交流，并表示感谢中央提供了更多机会(图)
115,厦门市委常委、副市长康涛拟任泉州市委副书记，推荐为泉州省委市长人选；曾任厦门发展委员会副主任、党组成员；曾在厦门集美区挂职任区长助理
116,全国养老金缺口今年将超3000亿，为填补财政补贴压力，划转国有资本充实社保基金的工作已进入实施阶段。
117,佩德罗表示，让他拒绝曼联两个因素是穆里尼奥以及小法的劝说，他希望在这里和穆帅继续赢得冠军
118,发改委拟对为七大类重大投资工程包等项目发债融资的优质企业降低门槛，发债企业相关数量指标不受限制；业内认为未来几个月城投公司将迎来一波发债高峰。
119,衡阳一退休干部因不满安置房分配方案，与家人多次到工地阻工闹事，将村干部打伤；其妻子爬上挖机臂上3个小时不让挖机动工；丈夫因故意搞出对他家不利。
120,20个省出台深化户籍改革意见，敦促各地出台户口迁移政策，并向社会公布；多地已划定新型户籍制度成型期限，将在2020年基本建立与全面建成小康社会相适应。
121,景德镇市发布高温黄色预警：预计未来3天我市最高气温可达35至37度，请注意防暑降温。...
122,美国一男子观看美式足球赛，意外发现前排女子劈腿，写下告密小纸条提醒男友回家要检查女友的手机，并提醒女友要查手机(图)
123,"中国工程院院士透露，烟大海底隧道方案将在半个月内上报，并希望让项目进入国家十三五期间开工，希望最早在""""10三五""""期间竣工，最早开工(图)"
124,西安雁儿湾污水处理厂散发恶臭，居民有窒息感觉，污水厂已经建成多年，多次举报臭源；污水管理厂建成后，已经多次被举报，多人举报不敢开窗户(图)
125,眉山发生枪击案1人落网或为寻仇四川眉山闹市枪击事件，1人受伤，或为找仇；事发后警方已介入调查，目前伤者已找到，有犯罪嫌疑人已报警，警方仍在进行
126,常州女贼偷官200万财物被抓，称不准向检察机关提合肥案件，如果乱说就弄死我，还可能被加重处罚；警方称女贼不准乱说话，不准对检方提法院提法庭提出申请
127,克孜勒苏柯尔克孜自治州发布雷电黄色预警：预计未来6小时内乌恰县境内将出现雷电活动，并伴有短时强降水、大风、冰雹等强对流天气，...
128,组图：北京地铁亦庄线台湖车辆段试车线上，一列车在调试过程中冲出试车路冲入张台路，抢险人员已赶赴现场，具体原因正在调查中。
129,长沙凯通国际城小区一租户租户从30楼坠下身亡，事发时正在窗户处坠下，身上残留一摊血迹；事发当地租户，物业工作人员冲洗地面上的血迹，目前已被封锁，警
130,今日中午11时许，南京方山定林寺藏经楼发现一男子悬梁自尽，警方赶到现场后发现该男子系烂尾楼，该藏经馆建了好几年，因资金问题未完工属烂尾，平时很少有
131,央行发文称消息提前泄露，午盘后地产股直线飙升，有市场质疑消息早盘为蓝筹行情，30日沪指为蓝籌行情；午盘前地产跌幅超过6%，30天沪指蓝筹市场蓝筹。
132,中国将再次在南海部署海洋石油981钻井平台，进行油气勘探，去年7月，981钻井台撤离西沙海域。越南海事部门称，中国在西沙部署981平台引发越南抗议
133,湖北阳新县政法委书记向书记开炮，自己拎包拿杯子挺自然，当事人称不能自己拿一拿，当书记有人代劳小事；当地官员批评官僚细节被批评者承诺
134,"""兰州市发布雷电黄色预警：预计6小时内,我市大部地区将出现雷暴、短时强降水、大风等天气，局地可能有冰雹，请加强防范。..."""
135,合肥：女子公交车上大喊停车，有人耍流氓，受害女子抓住对方小伙小伙；事发时身后人多拥挤，发现其裸露下体做不雅动作，警方调查发现小伙今年20岁，是
136,宜昌兴山县今日下午发生山体坍塌事故，目前已致4人死亡5人受伤，1辆货车、1台轿车、2辆摩托车受损；事故现场已实行交通管制，受伤人员已送医。
