4880,东营：男子在清风湖西门游玩时，被一汽大众燃放的烟花附着物砸伤，致其头部、耳朵等多处受伤，事发时老婆在游玩，儿子被烫起水泡；事发地点为8点左右。
4881,组图：中国建水电站登上几内亚货币，印中国制造的风景，几内亞最大面值的20000法郎纸币印上中华风景；中国电建承建的凯乐塔法郎2015新版发布发布。
4882,成都：20岁花季少女长期戴美瞳致肿瘤，疑因长期佩戴隐形眼镜导致，大面积肿瘤已遮盖整个左脸，甚至逼近上颚；医生诊断为导致癌瘤诱因之一，已错过手术。
4883,最高法：消费者通过网络交易平台购买食品、药品遭受损害，网络购物平台提供者如存在不能提供食品和药品的生产者的真实名称、地址与有效联系方式等。
4884,华山回应山顶宾馆米饭卖15元消息：景区餐饮成本高是导致物价水平整体偏高主要因素，不存在消费欺诈和强制消费等违规问题；景区回应：餐饮费用不高。
4885,《好声音》盲选收官战：哈林吐槽解散：如果你当了那姐队的冠军，我帮你们写歌，如果我当了姐队冠军我帮他写歌；如若你当她那姐，我写歌写歌。
4886,株洲市发布雷电黄色预警：预计株洲地区、株洲县、醴陵市未来3小时可能发生雷电活动，请注意防范。...
4887,杭州浙车牌摇号申请结果公布，共收到502129份申请，申请总数比上个月少了约10万；申请人数减少也意味着中签率将提高，中签者数或比5月份高(图)
4888,网曝珠海一医生在病人面前抽烟，被政府严厉控烟，医生面部被电脑屏幕遮挡，拍照曝光；涉事医院相关人士否认，已作检讨并扣奖金，涉事人员予以否认(图)
4889,黑龙江伊春市交通局局长徐忠义因变相占用办公用房被免职。
4890,镇江：痴情老汉与已故妻子相伴40年，写下一首情诗《春天一到鲜花开，日夜夜夜想英来》，写给已故丈夫朱瑞英的；妻子患糖尿病，与其独守老宅，留下情诗。
4891,哥伦比亚22岁模特在中国机场时被发现手提电脑里藏毒，或面临死刑；其亲人朋友正筹钱请顶级律师为其辩护，家人正筹资请顶尖律师和团队辩护
4892,重庆：12岁女孩因父母离异，与半瘫痪父亲交流仅限于要钱，如果父亲不给，会拿棍子打父亲；因长期酗酒，女儿性情大变，伸手要钱未果，父亲无奈报警(图)
4893,快讯：诺埃尔14+13奇才惨败76人老鹰主场不敌黄蜂，凯尔特人击退黄蜂
4894,南通：男子在长江捕获重达9两的江刀王，曾获世界之最称号(图)
4895,组图：沈阳一企业家两次送百万重金酬谢其20多年前收留3名身无分文小伙，20余年前曾多次寻找过小伙；其中最小的男孩黑黑瘦瘦，脚上流血极少说话。
4896,微软正计划9月发布一次开始菜单，并对锁屏屏幕进行升级。
4897,中纪委秘书长崔少鹏空降吉林任省纪委书记，是十八大后的第四人；此前，崔多次从中纪部任上空降的地方纪委记记，也是十8大后第4人。
4898,大连市发布道路结冰黄色预警：预计9日早晨至傍晚，长兴岛地区由于积雪出现道路.冰，将对交通有影响。请注意防范。...
4899,合肥推进公共场所无线局域网建设计划出台，在公众场所免费无线网全覆盖，将在明年实现重要公共公共机所无网网全盖盖，到2017年，巢湖、长丰、庐江等重点。
4900,"""[拌饭]陈红:房祖名一个人毁了一部片子;陈奕迅想和张学友演同志片:要全裸也可接受;杨子晴转护陶喆:我也有错我配不上他"";杨喆:陶喆我也没错。"
4901,食药总局抽检129个方便面调料包铅、总砷、无机砷指标符合《食品安全标准食品中污染物限量》相关规定
4902,福建安溪茶厂散装铁观音被检出稀土超标8倍，两家安溪厂商回应称茶叶只在北京等北方市场有售，并未流入福建市场；两家厂商表示，茶叶仅在北方有售(图)
4903,郴州：苏仙区水务局副局长胡小华等人参与赌博，被查获，其中两人被免职，两人受党内严重警告处分并免职；汝城县国土资源所副主任、国土局长等人被查处。
4904,长沙：女孩公交车上遭遇色狼，大声质问公交司机，并且报警、求助司机；公交乘客和乘客无人帮忙，司机扭打，最后下车后司机与乘客扭打致其心寒(图)
4905,俄媒称俄能源航天火箭公司欲出手不再需要的海上火箭发射平台，这个平台现在是国际公司海上发射公司使用；俄专家称中国有兴趣购买海上平台
4906,谷歌生命科学部门开发了一款可用于临床试验和药物测试的健康手环，可测量脉搏、心率、皮肤温度等环境信息；该设备不会作为消费产品推广。
4907,2013年度中国十大考古新发现揭晓，北京刘济墓、西安唐上官婉儿墓落选，因墓地被盗等原因落选；其中西安墓和上官昭容墓墓地都曾被盗，考古信息流失导致
4908,厦门：台风灿鸿登陆杭城密码，值班副所长在抗台时分心3小时后被分心，警方让值班警察分心近3个小时，称我被强暴；警方派出所抓住女子
4909,组图：兰州索道脱轨6缆车滞空不动，23名游客胆战心惊滞留在高空数小时，救援人员救援无效将其救出，目前已致23人遇难；索道始发点，2个吊厢被困半山腰
4910,台媒爆料，新一代将采用1200万像素摄像头，订单由大立光独占，代工厂依然是鸿海和和硕。
4911,"""常德市发布雷雨大风黄色预警：过去6小时常徳市区、汉寿县、石门县、桃源县已经受雷雨中风影响,阵风9-10级并伴有强雷电，且可能持续，请注意防范。"""
4912,苹果首款智能手表今日接受网上订购，内地反应热爆，五款预定额首天已爆满，每只售人民币12.68万元一款，包括每只卖12.68万。
4913,韩流明星金秀贤父亲金忠勋上世代曾担任成员，父亲是金忠勳；金忠勛父亲曾任人气乐队成员；相关人士透露，儿子是成长，对歌手活动渴望比较大(图)
4914,今起，浙江省将最低月工资标准调整为1650元、1470、1350元、1220元四档，调整后的最高涨幅达12.9%。
4915,加拿大亿万富豪苑刚遭分尸辱尸案死者胞弟苑强申请遗产管理权，称其不当致富；死者父亲称其不当，担心被捕的嫌犯一家人不能致富，担忧被捕(图)
4916,沈阳军区第16集团军副政委邵忠海已升任吉林省军区政委，成为正军级将领；前任胡杨少将出生于1959年4月，未满退役年龄，官方暂未公布去向。
4917,长春打拐办称华联门口女孩被喂药乞讨，网友转发称女孩是被拐，事发地点不同，有河北、天津、山东等地；网友称其事发时有山东、内蒙古等地(图)
4918,平凉13岁男孩因寻人启事敲诈家属3万元，被判缓刑，因涉嫌敲诈被判刑，曾以非法占有为目的，谎称小孩在其手中，称不及时打钱就将其卖掉，被警方拘留期。
4919,黑龙江庆安火车站枪击事件死者家属称其生前两个愿望已实现，两儿一女被送往福利院，事发后铁路公安以救助款名义向家属发放一笔补偿，警方已介入调查(图
4920,窦唯旧爱盘点：初恋姜昕高原发微博：自私的人永远悠然自得，不用考虑别人的感受、不用负任何责任(图)
4921,外媒称中国正考虑将地方置换债券额度增加1倍，最多额度为5000亿-1万亿人民币，最终额度还可能调整，且需要国务院批准。彭博称彭博寻求置评传真
4922,广州一女子醉酒后乘车遭性侵，自首仅承认发生关系；自称醉酒时被性侵仅承担发生事系；女子自首却仅承诺发生生系；目前该嫌疑人已被警方刑事拘留(组图)
4923,西安：丈夫喜欢赌博，丈夫将十多万财物藏在电动车坐垫下，险些将其弄丢，幸被民警无意中发现，最后完璧归赵；男子骑车发生车祸险些弄丢所幸被警方发现。
4924,惠州病例同航班密接者分别在番禺、花都、海珠居住，6人无发热症状；目前在广州发现的6人与我国首例输入性中东呼吸综合征患者，仅为有限度人传人。
4925,希腊公投内容遭外界质疑，投票内容技术性很强，普通民众似乎不太能理解；希腊债权人目前已将目光投向希腊全民公投，然后再与希腊商讨债务危机解决办法。
4926,空军后勤部部长向阳：全军统一更换2012式军车号牌，5月1日正式启用，2004式即行废止。
4927,组图：南阳社旗发生恶性斗殴事件，现场好比香港古惑仔片吓死人了，开车直接把人撞倒好远现场血腥惨不忍睹，伤亡情况不明
4928,金华：今日下午16时许，永康象珠镇文雄烟花爆竹销售点在为顾客试放烟花时引发火灾，致其它爆竹爆炸，3人死亡花爆炸；截止晚上19时4人死3人受伤，伤者已
4929,组图：天津爆炸核心现场，集装箱、仓储物品被炸成碎片；爆炸现场整车物流库拍摄，组图）
4930,世乒赛：丁宁4-3险胜武杨，中国队提前确保女单冠军，决胜局中丁宁挺进四强，中女队挺进女单决赛；中国女单挺进4强，并以4比3战胜队友武杨最后一个
4931,组图：网曝新余市委书记刘捷在山中捡垃圾，官方回应偶遇，称其曾在宣传部门实习，工作就是写微博；官方称书记曾与网友互动解释，称写博博
4932,黄冈：男子吸毒产生幻觉，抢夺夜市摊点抢夺菜刀后又捡起地上的砖头，站在马路边上拦截过往车辆，被正巧回家民警制伏；目前该男子因吸毒被行政拘留(图)
4933,今日可买除夕火车票，多数人选择在当天回家，有人称穿越漏洞；12306网站同各方博弈将持续，同时还要与黄牛、抢票软件斗争，同各地博弈也将持持续
4934,北京军区某工兵团挖掘机连续完成侧翻车辆救援、防坦克壕构筑等多项工程作业任务，有人认为这些绝活并非大纲要求的训练内容，部分官兵认为是大纲。
4935,"""鹤壁市发布雷电黄色预警：预计未来6小时我县境内将有雷电活动,局地伴有短时强降水、大风等强对流天气，请注意防范。..."""
4936,武汉南湖大道一出租屋突然爆炸，一对年轻夫妻被烧伤，女儿逃出房间求救，一家三口被送医抢救，家中物品挂到树枝头，防盗门都被轰开，屋内物品被烧(图)
4937,福州：孕妇借用食品店厕所盗走苹果手机，主动退还手机；丈夫主动提醒妻子老公，你的手机在哪？；孕妇主动将手机揣进口袋，警方已对其行政拘留15日。
4938,江门江海区江南小学坠楼案调查有结果：未盗窃老师2000多元钱，系自行从五楼跳下排除他人所为；目击者称其并无盗窃教师2000元，系学生家长痛苦哭泣(图)
4939,常州：90后会计跟高手买彩票，花1380万投注时时彩，花了1380元买彩，中奖奖金高达3万元；受害人遍及苏、湘、浙、粤等20多省市，涉案金额达4000万
4940,日媒称中国裁军大使傅聪呼吁全球领导人访问广岛和长崎，称不希望日本被投原子弹是有原因的，但不愿让日本以强调受害姿态掩盖历史心怀警惕。
4941,"""阿勒泰地区发布雷电黄色预警：目前阿尔泰市及福海、富蕴南部已出现雷电活动，并伴随局地降水，预计今天夜间，北部、东部山区及南戈壁有阵雨，预.今天北"
4942,山东高招录取控制分数线公布：文科562分，理科568分，文科5902分；理科510分，艺术理319分。
4943,临沂市发布雷电黄色预警：目前在我市南部地区有强对流回波生成并发展加强，预计今天中午到夜间我市大部地方将有雷雨加强；预计明天中晨到夜时我市小部地.
4944,美媒称中国正准备建造055型12000吨新式巡洋舰，装载128单元垂直发射系统等设备，媒体称该战舰可匹敌美国伯克级战舰，是中国建造的最大水面战舰。
4945,东方航空发布一季报，营业收入224亿元，同比增2.61%；净利16亿，比上年同期增862.93%。
4946,黑龙江鹤北林业局一辆轿车因操作不当失控坠河，当场致5人死亡，事发路段归鹤北局管辖，目前已致5死亡；事发地段归萝北林区管辖。
4947,新乡市发布雷电黄色预警：我市的市区和辉县已经出现雷电活动，预计今天傍晚到夜间我市其它县市也将出现...
4948,今日下午16时许，达州石板洗煤厂附近一货车行驶过程中发生侧翻，将一辆正驾驶的小轿车压在，现场已经看不到被埋轿车身影，目前车内还有3人，车内人员生死
4949,微软宣布10版本，主要分为家庭版、移动版、版、企业版、教育版等，其中的正式替代。
4950,南京一对夫妻网上结识大龄女青年，由丈夫出马强行与对方发生关系，拍裸照威胁受害人付钱消灾，涉案金额高达30多万元；该男子因涉嫌抢劫罪被批捕(图)
4951,"""[夜宵]放弃公务员北大硕士干装修月入百万;男子获赠奔驰车抛妻弃子离婚,第二天与富婆结婚;女子走路玩手机太专心腿卡进下水道;女孩走路戏手机。"""
4952,东莞两名3岁男童因不配合老师做早操，多次被老师关进教学楼三楼暗室，并且吓唬说妈妈不要走；涉事男童被幼儿园实习教师关黑屋，称是性质严重体罚。
4953,武汉新洲区委原书记王世益、宜昌原副市长郑兴华、葛店经济开发区管委会原主任陈伯才3人严重违纪违法违法被双开，其中2人受贿被开除党籍和公职。
4954,组图：四川多地迎来高温，8000多人涌进游泳池避暑纳凉，现场犹如下饺子；成都死海旅游度假区迎来避暑高峰，8000余人涌入游泳场避暑，当天8000多名涌入泳
4955,组图：下午14时35分许，临沂机场外一男子从机场大厅出来后，旁边一名男子持刀捅数刀，随后被群众制服，凶手被周围群众控服；具体动机不明
4956,承德：我市中小学电子学籍系统将于今年年底与全国联网，2014年正式实现开通。
4957,沈阳男子持续打嗝半年才就诊，一查出胃癌；医生称因食物过量导致，一个月后才能停，一直到两小时才能止，一次就医后检查结果显示为胃癌，医生介入调查。
4958,北京今晨刮起偏东风，能见度提升，8时大部分监测站能见到达到4～10公里，预计17日雾、霾将有所减轻，空气质量将再度污染；预计今日雾或有所降轻。
4959,深圳宜家一男员工当街偷拍女子裙底私处，当场抓获，涉事男员警方拘留；涉事女员工被丈夫丈夫的面大胆偷拍，称是与女子起争执，当事人员工已被开除(图)
4960,成都：警方锁定肇事司机车牌为川，警方通报称肇事车车牌是川；目前警方已锁定车主本人，并已成立专案组，敦促嫌疑人尽快投案自首；肇事者已被刑拘。
4961,今日下午，湖南东安县一男子从5楼扔下一女婴，孩子当场死亡；警方初步判断为符合妇女分娩现场地遗亡，警方已抽调专人，正在侦查中(图)
4962,东莞：男子树下掉下一人被砸伤腰椎，事发第二天举家搬走，因无法办理住院手续无法住院，举家走走；因躲避医药费无法搬走；事发前3名老乡在树上玩方便面
4963,宜春：网传宜春万载县父子偷拍县长收礼被捕，父子俩均涉嫌组织黑社会组织罪，警方称系组织、领导黑社會性质组织；官方回应称系因组成黑社团罪。
4964,河南干尸男童事件责任划分：死者自身患恶病质承担70%责任，救助站管理过失15%；政府称将赔偿精神抚慰金、丧葬费等共计133946.15元，赔偿金1330元
4965,福州马尾名郡小区30号楼一妙龄女疑因炒股亏损8楼坠亡，部分邻居称该女子可能是炒股虧了，才导致轻生，家属深感惋惜；家属称其或因炒钱亏了才轻生(图)
4966,武警广东边防总队：5月1日起，全国武警部队对现行07武警作训服进行改款，取消肩章和织领花，佩戴领章。
4967,曝哈文导演被曝提交离职申请后，吕逸涛已被锁定为猴年春晚总导演；知情人称其担任春晚前期准备会，此前曾被任命为春晚执行总导师，冯小刚任春宵晚会
4968,漳州实验小学发生疑似食物中毒事件62名学生先后感到腹痛、头晕、呕吐症状，目前已返校或回家，其余学生均已返家；目前该校共62名男生学生已被送医(图)
4969,宁波：女子患上尿失禁，每晚都穿成人尿不湿睡觉，自称每晚尿床多，自卑又自卑；医生查不出病因，3年来每天尿床都不打呼噜；家人查不到病因后自卑自卑。
4970,温州：公务员通过结识女网友后第六天受骗汇出1万元，一个月内被骗走30万元。
4971,内蒙古自治区发布雷电黄色预警：6小时内巴彦淖尔市西部、鄂尔多斯市东北部、包头市南部、呼和浩特市、乌兰察布市、锡林郭勒盟东北...
4972,三星发布新款手表，将在今年数箭齐发，或在5月份曾爆出的应用。
4973,铜川市一元民生保险实施方案公布，户籍人口和暂住人口在一年的保险期限内享受见义勇为救助责任保险两项保险服务，被保险人每年缴纳1元保费标准
4974,"""【头条拌饭】徐若瑄巴厘岛办私人婚礼,林心如当伴娘;文章马伊琍飞抵夏威夷,疑度假共补裂痕(图);章子怡为汪峰庆生晒蛋糕:你我为爱而生(图）"""""
4975,泉州晋江五中校门附近发生学生打架事件，一名学生被刀捅身亡，2人重伤，其中1人重重；警方目前已介入调查，主要犯罪嫌疑人已被控制
4976,赣州：8名监狱服刑人员上访至少6人死亡，其中1人被其他服务人员杀害，1人坠楼身亡，另有1人死因不明；媒体调查发现，2008年至2014年间已发现8名死亡。
4977,甘肃定西地税局原副局长刘生海受贿近千万，被执行有期徒刑22年；其受贿金额近百万元的巨贪，开始于当初对于年节小礼的来者不拒；其堕落腐化之路
4978,广州：情侣相恋7年后结婚前分手，女方要求分割近千万财产；法院判决男女双方一起同居做生意，所得应该分等；法庭判决认定男方同居一起做生产应该均等。
4979,江西修水一男子微信认识女神，一年半被骗近60万，称其长相普通的女女摊牌坦白后，选择报警；警方破获15起利用微信平台诈骗案，并将犯罪嫌疑人。
4980,河南省发布雷电黄色预警：预计未来6小时内，漯河、信阳、驻马店、周口、开封、商丘六地区及固始、新蔡、鹿邑、兰考、永城部分地区有雷电活动...
4981,中央气象台：27日夜间至31日，四川盆地、重庆、贵州、江南西部和北部、江汉等地的部分地区将先后出现大到暴雨，局部大暴雨(100～120毫米)
4982,西媒曝皇马正研究用拉莫斯换德赫亚的可能，拉莫茨坚持要求引进德赫斯，不得不考虑放弃离开可能
4983,北京：王学兵昨日回家中被拘，妻子称其曾是禁毒宣传员，曾是一名禁毒传传员；前妻表示不可置信，没什么好回答。
4984,组图：郑州居民楼着火事故已致13死多伤，伤员严重烧伤，目前仍在抢救中。
4985,上海市发布霾黄色预警：预计25日下午至26日上午，本市平原地区有轻度至中度霾，能见度较低，请注意防范。...
4986,鹰潭：永丰县委宿舍楼改造遭公职人员质疑：政府未完成拆迁任务，被停发工资；官员称政府无法承担拆迁费用，公职员员质问政府是否是想把从我们手里买来
4987,组图：杭州贴沙河大片死鱼浮出水面，清洁船捞起一百多斤；河道保洁员称因天气闷热水中氧气不足致大面积鱼类死亡，由于天气气中氧不足导致大量积鱼死亡。
4988,组图：大连一烈士陵园杂草丛生，两扇大门不知去向；为民族解放、新中国成立宝贵生命的烈士吴屏周在抗日战争中牺牲。
4989,北京顺义区8起违纪违法案件，3人被警告处分，其中，仁和镇原团支部书记张东林因犯交通肇事罪致1人死亡，1人被开除党籍；其中一村委会主任沈玉山被开
4990,无锡：3人盗窃电缆被警方批准逮捕，事先踩点计划盗窃全市公安机关抓现行、促安全专项行动，事后3人被抓；嫌疑人事后踩点后逃窜，连续撞开两道关卡
4991,<夜读>古装电视剧中的鹤顶红有什么有效？古装剧中有哪些毒药？有人说鹤顶比鹤頂红还重口味，有人称其为仙人，还有人为其解毒而治(图)
4992,2015喀山游泳世锦赛最佳男运动员：何霞发自喀山，荣获最佳运动动员奖；荣获喀山世锦泳最佳女运动者；中国游泳队获最快游泳时间；何霞荣获游泳动员，何霞获最
4993,福建最美高校学生点赞榜揭晓：厦门大学、厦门理工等10所高校跻身点赞top10十强，制作团队或个人将获千元现金奖励；厦门、厦大、华侨大学等10高校入围十强
4994,媒体称云南官场成受周永康腐败案震中地区：云南省委原书记白恩培涉嫌严重违纪被查，今年1月7日，大理市市委书记褚中志被查；今年2月，市长褚中意被
4995,中组部：选派第一书记要求党组织软弱涣散村和建档立卡贫困村要做到全覆盖，要求政治素质好，坚决贯彻党的路线方针政策政策，有较强工作能力，甘于奉献。
4996,烟台市发布大风黄色预警：受较强冷空气影响，明天午后到后天，北到西北风，海面逐渐增强到7-8级，阵风10级，陆地6-7级，...
4997,深圳沙井街道办原副主任李鼎荣老婆欲花钱捞父被骗2700万，老婆急于捞人，老公急于捞人，给其750万元帮助；其老婆称其知道领导能运作，最终被判刑。
4998,中国抗癌药海外代购第一人被诉，一年要持续用药需要二十八万八，在浙江还纳入医保；该药在中国市场上一盒是2万四，一盒要持久服用，需要终身服用(图)
4999,最高人民法院原副院长王怀安因病医治无效，于13时25分在北京逝世，享年100岁；其遗体告别仪式举行，全国人大常委会副委员长王胜俊、原院长肖扬参加送别。
5000,欧盟前竞争专员称，欧盟委员会将很快决定是否针对谷歌提起反垄断诉讼；过去5年，一直在调查谷歌是否滥用在欧盟搜索市场上的主导地位，打压旅游和零
5001,宁德：男子驾小车与货车交会，致3死3伤，其中一人系怀抱婴儿，事故致2人死亡；事故原因正在调查中。
5002,新乡市发布雷电黄色预警：我市的延津已出现雷电活动，预计今天夜里我市红旗区、卫滨区、牧野区、凤泉区以及新乡县、获嘉、辉县、卫泉区、鳳泉区等及新郷县
5003,珲春：23人客车侧翻致1死多伤，车上最小乘客仅6岁，车内最小的乘客只有6岁；事故造成1人死亡22名乘客受伤，事故原因不明
5004,九江市发布大雾黄色预警：预计未来12小时内，九江大部分地区可能出现能见度小于500米的雾，请防范。...
5005,机构预测：股市场大涨，股杠杆资金入市规模将达到100亿，融资余额将达100亿；股融资金额大规模入市，市融资规模或达百亿，创下新高新高
5006,东莞：已婚少妇为初中男同学在酒店开房，两小时后突感身体不适猝死，家属称死者下身仅着内裤，警方排除他杀可能，死者当初仍在接受调查，目前仍是谜团。
5007,重庆江北区一小区8户违建被拆除，执法人员推测是在建游泳池楼房加盖，占绿地搭花台；执法队员称这是在游泳泳池，楼顶建泳池加盖（图）
5008,组图：昆明学院人才店网上入驻65名应届大学毕业生，店铺商品全部是小鲜肉，65位应届生，大多数学生处于灵活就业阶段，许多学生还在等待公务员考试。
5009,长沙：大学毕业男生为找回女友4年多回忆，追小偷被刺伤，被小偷掏出匕首划伤；男子因不满女友被偷，愤而将其刺伤；女友称我只想找回(图)
5010,上午10时许，海口金盘海南联通办公楼三楼一男子爬上窗口欲跳楼，并在微博上直播自己将要跳楼；目前公安，消防，救护车辆已在现场，公安消防救护已经到现场
5011,温州：12岁男孩因大人粗心离开人世，两人吃老鼠药致其中毒身亡，经抢救无效离世，目前体征稳定；两人因误食炒粉干，到家呕吐腹痛昏迷，事发前天各一方。
5012,组图：今日下午，吉林通榆北城郊发生强大龙卷风灾害，所有建筑地面设施被夷为平地，造成巨大损失。
5013,南京警方公布石杨路肇事宝马车肇事时车速为195.2km/h，至于为何将车开到如此之快，尚无定论，家属称不准备协商解决，走法律程序解决此事。
5014,组图：义乌一辆拉沙货车侧翻，将4岁女孩压在车底，经过路人热心救人才发现救得孩子是自己心疼女儿；经救人后才知孩子系自己的女儿。
5015,张家口：55岁男子学习好整天活蹦乱跳，9名小学生昏迷3个多月，车祸身亡；车祸造成10人受伤，其中9人受轻伤；事发时车祸已致10人死亡，9人重伤(图)
