2432,温州：23岁小伙回家途中，在火车车厢抛撒5000多元现金，乘警发现后发现其随身携带的现金一分不少；乘警疏散旅客，发现随身带现金5278元，一分之少，随身一分
2433,哈尔滨：男子网店买泻盐收到火碱，整个喉咙都在冒火，称就像喝烈酒整个嘴巴都冒火；医生称要是恢复得好，食道就可能保住；减肥男误饮火碱(图)
2434,：骑士客场106-101击退公牛，总分3-2领先，詹姆斯38分12篮板6助攻，欧文带伤出战，得25分，香波特13分7个篮板，罗斯带伤战战，27分，埃文26+9。
2435,惠州病例同航班密接者分别在番禺、花都、海珠居住，6人无发热症状；目前在广州发现的6人与我国首例输入性中东呼吸综合征患者，仅为有限度人传人。
2436,南京：父子俩频频来往深圳贩毒，通过快递买奶茶等各种毒品，共计37公斤，缴获冰毒、粉共计16公斤毒资37万元；因赌输钱被拒，父子两人共抓获37万(图)
2437,东莞：病死猪肉制造黑心腊肠地下作坊，查获病死豬肉及其制成品近1000公斤，3名犯罪嫌疑人已成功落网；该作坊为提高合格产品的相似度，已被警方掌握。
2438,"消息称百度143.51,-3.91%)副总裁李明远将离职，将出任京东(滚动资讯)"
2439,海南万宁一祖屋莫名被同村住户用挖机推倒，屋内供奉祖宗的灵牌被捣毁，村委领导正全力协调重建；事发前两名肇事者已被拘留，事发后3女儿整天在家哭闹。
2440,今日上午9时许，湖南安化县一辆小客车坠入近百米山坡下，车上9人死亡，其中一人乘客为2岁小孩，另有8人生还，其余8人已死亡；另8人送医无生命危险外
2441,酒泉市发布道路结冰黄色预警：预计未来24小时内，我市仍有对交通有影响的道路結冰，请注意防范。...
2442,日媒：美日二战中原是敌对国，美日为了显示当下美日间坚固的同盟关系；美军称当下中国正加强对南海的实际支配，美方表示，是为了牵制中国(图)
2443,乐山：9岁女童将自带吊床系石灯笼装饰灯上玩耍，导致石灯被拉倒砸伤，送医后抢救无效身亡；事发时，当事人使用景观设施不当，相关单位未充分考虑外力。
2444,"""成都市发布暴雨黄色预警：过去6小时,我市西部山区出现了较强降水，预计未来6小.我市中西部地区将有强降雨天气，部分地方降雨量在50毫米以上，并伴有"
2445,组图：上海一名女孩手拿铁链乘公交，赤裸双脚被铁链铐住，浑身脏兮兮被铁鍊铐住；事发时女孩被自称母亲的人抱着，目击者称女孩与其母有关系。
2446,摩根士丹利将公布是否将中国股纳入新兴市场指数的决定，若股被纳入则意味着海外资金配置股又多了一项指标，股引入海外活水也多了了一个突破口
2447,徐州警方破获特大贩卖枪支案37名嫌疑人被抓，共缴获枪支零件一万多件，弹药两万多发，枪弹两万余发；枪弹为汽车轮胎气压5倍，在25米之内可致命(组图)
2448,重庆一女子误乘红色出租车误搭红色轿车回主城，失联后失联，警方初步确认死者为其家人，事发前该女子与其联系车是黄色的出租司机，目前已被警方刑拘拘留
2449,菲律宾财政部长称中国提议让亚投行董事会，一些国家将此举解读为给予小股东话语权，称此举对较小国家有利。
2450,聂树斌案代理律师发文称其丧失了道德，被告人陈光武诽谤罪，称其已诽谤被告上法院；此前洪道德因聂树案听证会被诉诽谤，被指诽谤案件已受理。(图)
2451,昆明：农妇被指化鱼事件：村民户口要农转城，一年收房、3年收地；村民为闹访，上访者被要求配合调查；当地政府回应称没说法(图)
2452,阿里巴巴将向美国在线市场出售美国子公司11，首次进军美国电商市场未获成功；阿里首次出军美商电商，未获得成功。
2453,广州：80后大学生低价回收废旧可编程控制器元件，翻新处理后售出，涉案2亿惊动公安部；涉案涉案1亿惊怒公安；查获86万枚镭射防伪标签，已被一网打尽。
2454,厦门：男子带车胎和打气筒坐火车到厦门，只为游泳私渡到金门，被警方抓获；自称是卖气球小贩，自称为赚钱赚钱的家伙，曾称为打气球，已被治安拘留。
2455,组图：武汉一列动车设备故障在蛇山下趴窝，断电后乘客在车厢里蒸了一个半小时桑拿，有人砸破车窗，许多人下车透气；事发时车上有老人小孩(图)
2456,郑州天河区一辆宝马越野车突然自燃，所幸未造成人员伤亡，事故原因仍在调查中。
2457,徐州一公务员在房产公司领工资，卡是父亲身份证开的户，官方通报称其父亲保管和使用，只不过是用户；官方回应称系父亲在保管，只是用父亲的身份證开的。
2458,网传威海一青年因爱国言论被打伤，校方称其因网上意见不合者所为；据悉该青年在校门口群殴受伤，并贴出我到了，出来应战照片，目前已被警方打伤(图
2459,毕节大剧院彩排时舞台突然坍塌，台上80名合唱队员自由落体状坠落，致6人轻伤，另有2人伤势较重，事故原因正在调查之中。
2460,"""大连市发布大风黄色预警：13日白天到夜间，渤海偏北风7级阵风8级中午转西北风6级夜间减弱到5到6级，渤.海峡、黄海北部偏北.6级..."
2461,福州仓山学生街一酒吧发生打架事件，致1死2伤，警方通报称该微博内容不实，经调查，该博博内博不实。
2462,湖南湘潭一产妇做剖腹产手术时大出血不幸死亡，家属称如发现及时不至于死亡也不会隐瞒这么久；医院称未确切确切原因，医生称不能确定产妇是否死亡(图)
2463,南宁：两男子午夜遭遇警察拦截，抢回身份证逃跑，躲进粉店厨房，两人被吓跑后躲进厨房；警察称两人是警察，要求查看看看，并报警后脱险后逃跑(图)
2464,兰州警方破获一起涉嫌非法吸收公共存款案，涉案金额高达2.7亿元，涉及群众401人；因资金链断裂，案发前4天主要犯罪嫌疑人跳入黄河自尽，案情暴露，主要
2465,外交部发言人华春莹：缅北部分地区发生武装冲突，中方愿根据缅方意愿继续为缅国内和平进程发挥建设性作用。此前有报道称果敢少数民族地方武装与中国有联系
2466,五一期间，高速路迎返京高峰，京藏高速出京拥堵较前一日下降，四条高速返城方向易拥堵；四条公速返京方向将出现10公里左右的排队拥堵，五条公路易拥挤。
2467,今日凌晨5时58分，遵义红花岗区居民楼发生局部垮塌，目前已联系到16人，3人处于失联状态，初步判断长期外出；目前有3人失联。
2468,哈尔滨：户籍改革涉及农民进城后在医疗、低保、教育等方面能否享受与非农业户一样的待遇，如果上边这些事情不落实，农民根本不愿意换户口簿，恐怕尴尬。
2469,邵阳：邵阳县纪委昨日深入县城检查限宴令落实情况，当天全县没有一起喜庆宴，干部群众对限宴拍手称快。
2470,回应融资搁浅问题：将择机对外公布，将在中国建立独立实体，拥有独立管理，服务器已设在中方，并注重引入中国战略投资者；创始人称要创办中国公司
2471,十八届中纪委五次全会将举行，查处的中管干部已达68人，其中周永康、苏荣、令计划等令计画等令計划等人倒下；周永厚、令谋划等被查，令计劃等人被查处。
2472,哈尔滨道外区一民宅改建过程中发生垮塌，已致2人遇难2人获救，失踪老人或被压在大预制板下，生还希望渺茫
2473,潍坊：9岁男童不慎落水，不慎坠河身亡，事发前曾与舅舅钓鱼，被舅舅救下，事后被救下后数次将孩子托出水面，被救时仍未脱衣，事故原因不明(图)
2474,成都双流县委党校副校长祝刚仁因违规使用工会经费发购物卡被党内严重警告处分，并被纪委通报违规滥发津贴、补贴、奖金和实物；校长、党委副书记被处分。
2475,组图：德阳一辆豪车放在地下停车场，车身贴小广告你不要我要等各种市民涂鸦留言，市民留言满满；车身上贴小廣告有钱任性等市民发表感慨的地方。
2476,质检总局将在双十一期间组织开展电子商务产品质量抽查，为消费者的购物车把好质量关。
2477,苏迪罗影响，平潭多个乡镇出现13-15级强风，或演化出强风、暴雨、高潮四碰头局面，有望演化成强潮、暴潮4碰头局面；受苏菲罗所致。
2478,为配合母公司联想集团宣布的重组移动业务计划削减支出，摩托罗拉移动将对其位于芝加哥的总部裁员500人，占员工总数约25%；此次裁员从即日起正式展开。
2479,日本首相安倍访美，称将让技术实力超群的日本中小企业或初创企业，帮助其进军产业集中地硅谷。
2480,"""阿勒泰地区发布雷电黄色预警：目前阿勒taylor地区中部出现雷电活动，预计今天到夜间，北部、东部及福海将有雷电..."""
2481,宾市发布雷电黄色预警：目前我市屏山县、江安县、南溪区和高县的部分乡镇已经出现雷电活动，预计未来6小时内我市部分地方将发生雷电...
2482,组图：太原一儿童乐园推出抗战剧情真人射击游戏吸引众多儿童参与，园区负责人称能不能组织工作人员扮演日本鬼子，让小朋友亲身感受一下打鬼子。
2483,平凉市发布暴雨黄色预警：预计12小时内我市华亭、崆峒、崇信、泾川、灵台等县区部分地方雨量可达到50毫米以上，暴雨和短时强降水诱发山洪、地质灾害...
2484,泉州晋江市人大常委会决定，任命王文晖为晋江副市长，聘用到晋江工作，聘期2年。
2485,烟台尝试大病提取住房公积金，允许职工本人、配偶或子女患重大疾病时提取，可提取419万元用于治疗；截至2013年10月，我市187名符合大病条件职工提取。
2486,上市第一周时，的产品销量甚至超过了备受期待的智能手表
2487,中国国航拟以12.07元/股，非公开发行不超过9.84亿股，募集资金120亿元；其中，74.5亿用于购买15架波音飞机项目，1.5亿元用于补充流动资金项目
2488,监管严查市场操纵，创业板受惊下挫，大盘风格变化，权重股爆发，沪指跨越4800点。
2489,山西太原一女孩遭暴徒抢劫强奸，用重物将女孩头砸烂，并将木棍插入喉咙；嫌犯被抓后将其打死，凶徒用重事将其砸烂；歹徒被抓获后将头部猛砸，歹徒用木棍勒
2490,玉溪市发布高温橙色预警：预计玉溪县元江河谷地区未来24小时，日最高气温将在40℃以上。...
2491,今日19时许，贵阳乌当区一加油站发生多车相撞事故，现场惨不忍睹，有车辆被挤成铁饼，具体伤亡情况不明；具体死亡暂不明。
2492,南京上半年空气质量最差，上半月共有112天是脏，环保局称污染天；上半个上半，南京空气为何脏？
2493,银川兴庆区原政协主席被指租给他人开麻将室，并多次被举报扰民；房东女婿再将房子转租他人，警方称不能认定屋内存在聚众赌博行为；房管局称不认定存聚众
2494,贵阳花溪一拆迁户抵抗征地拆房时爬上自家房屋顶楼，僵持数小时后坠亡，官方称劝说无效，村民自行跳下；官方回应劝说有效，官员称劝阻无效无效跳楼(图)
2495,<夜读>苏轼与苏轼之子苏辙之子，苏辙写诗给弟弟，称其苏轼是当红组合三苏，并称其为苏丹第一人；苏轼曾写诗赠弟弟苏苏苏轼真的是真的吗？
2496,兰州工业学院一大三毕业生宿舍喝啤酒，头部曾被击打，事发后头部被打伤；知情者称该男生家属已赶往兰州；事发前该宿舍曾被啤酒瓶击中，事故原因正在调查
2497,上午8时，耒阳政府门前大规模群众上访事件，上访人员转至市政府对面信访接待中心，截至上午9时许，上訪人员引领下转至信访中心；截至目前仍在处理中。
2498,韩国中东呼吸综合征痊愈出院人员增加1人，死亡病例为182例，确诊病例达182例。截至上午6时，韩国痊愈者达91人死亡，病例数达182人，确认病例均呈阴性。
2499,信使号将撞击水星，结束对太阳系最内行星的探测使命，在水星北极附近留下一个相当于篮球场大小的撞击坑；在该地区留下相对于籃球场的小撞擊坑，或
2500,截至昨日下午5点，东方之星号客轮翻沉事件天津的41名遇难者中，22名身份已经得到确认；遇难人员身份比对工作正有序进行，善后工作已有序开展，遇难
2501,"国信证券公告，公司以2015年6月末净资产的15%出资，即人民币658,548万元，参与21家证劵公司共同出资购买蓝筹股的联合行动。"
2502,北京军区某工兵团挖掘机连续完成侧翻车辆救援、防坦克壕构筑等多项工程作业任务，有人认为这些绝活并非大纲要求的训练内容，部分官兵认为是大纲。
2503,美国国家地质勘探局发布消息，秘鲁海岸发生5.4级地震，震源深度为14.7公里，目前暂无伤亡报告。
2504,沧州6·20持枪杀人案已有4名犯罪嫌疑人归案，最后一名涉案犯罪已被抓获，警方确定共有5名嫌犯被抓。
2505,三门峡：送货员丢包裹忘拿，丢在地上的包裹箱子忘拿；因单位效益不好，每个月快递公司才发1000多块工资，丢货日子已过去5天，丢掉的货物仍未下落(组图)
2506,组图：中国土司遗址成功列入《世界遗产名录》，目前中国世界遺产总数已达48项，继续稳居世界第二位；中国永顺土司城遗址成功入选《世纪遗产》名录。
2507,杭州：7路公交车突然起火，致29人受伤，警方宣布该案告破，目前嫌犯已被抓获，嫌犯系公交司机被抓；该男子现已在医院救治；目前已被警方抓获
2508,曲靖一银行工作人员疯狂设计骗局，4年骗得8000余万元，先后以政府招商引资项目为诱饵，骗取7名被害人现金8796万元。
2509,"""[夜宵]父亲去世16年隔空给30岁儿子送生日卡;父去世后隔空送30岁男子送来生日,打了个喷嚏也可能骨折儿子;博物馆恐龙展柜成投币箱(图)"";恐竜展柜"
2510,岳阳一银行门口发生枪击事件：目击者介绍，开枪者是20岁左右的青年，开膛者是运运员，开车者是押运员；目击人称开枪人是运输员，押运人员员员，运运车员员
2511,"印度发射国产烈火-5洲际导弹，该导弹长17米、直径2米，有效载荷1.5吨；印媒称中国杀手的""""烈火""""""导弹""，射程更远、可携带多枚核弹"
2512,厦门：70岁老人当全车人当坐便器，乘客称太没素质；老人在公交车上大便引起公愤，乘人纷纷指责老人太恶心；乘客吐槽称你干什么嘛(图)
2513,美联航一架飞机因不明计算机故障，计划起飞的航班无法起飞，全美范围造成航班延误；该公司称，所有航班的延误开始于中部时刻，直到公司确认飞机有正确的
2514,组图：武汉暴雨致城区积水严重，公汽淌水过中断的永清街，犹如在水中开巡洋舰；武汉武钢四号门外近20辆小车被淹，市民困难前行。
2515,徐州：海安县一村级河道现一具男尸，面部淹没在水中无法看清，事发前两人因琐事打架，将其打伤后赔偿数万元损失；两人曾因琐吵打过架，因纠葛结下仇怨。
2516,宜昌：男子凌晨打近2小时羽毛球赛，腰痛心慌胸闷，送医及时抢救无效死亡；医生诊断为横纹肌溶解症，目前正在市中心医院肾病科救治。
2517,大连阿尔滨俱乐部宣布接手原大连实德女足及辽宁青年女足，两队合并组建大连足球12年之久的大连女足；前助理教练石磊出任主教练
2518,组图：榆林一辆价值130万的玛莎拉蒂被遗弃路边4个多月无人管，车内堆满垃圾，车标、轮胎、倒车镜不翼而飞；居民称该车是无主车，车窗玻璃被砸碎。
2519,中纪委通报山西严重腐败问题，已完成对31个省区市和新疆生产建设兵团常规巡视，包括31个部门和中央企业党委常委、中央纪委巡视部门通报四风举报。
2520,广安：34岁男子筹办婚礼，新娘逃婚失踪，多次寻找新婚妻子维护婚姻关系无果无果，求助到法律援助中心，获得3.5万元彩礼钱；法律中心帮助下领回3万。
2521,怀化市发布雷电黄色预警：预计沅陵县、浦县、中方县、辰溪县、芷江县、麻阳县、洪江市、新晃县、鹤城区、洪城区未来6小时可能发生雷电活动，请注意防范
2522,伊朗核问题六国与伊朗达成历史性的全面解决伊朗问题协议，协议实施后，对伊武器禁运最长将可维持5年，对核弹道导弹技术转让禁令最长在8年后取消(图)
2523,成都：32岁男子因感情受挫跳楼，欲跳楼拒绝救援；前女友打电话劝说后，男子放弃轻生，被其发9条短信劝阻后爬回房间，被男友劝阻，被警察抱住跳楼(图)
2524,[拌饭]九把刀斩断十年情;田源否认婚内出轨:激吻是角度问题;周冬雨谈爱情观:顺其自然不消耗对方(图);周夏雨谈恋情观：顺其然然不耗耗对人(图）
2525,据太阳报》消息，包括奥斯皮纳、弗拉米尼、波多尔斯基在内的6名球员都将将在今夏被阿森纳卖掉，据悉其第一个要卖掉人是德国人，此前他们曾被降价出队。
2526,外媒称，中国央行通过干预以防止人民币大幅下跌，中央行指示国有银行代表其抛售美元；中国在交易的最后几分钟进行市场干预。
2527,据英媒报道，皇马副队长拉莫斯因续约不顺动离队的念头，已经告知经纪人
2528,组图：中国军人平均身高在1.88米以上，个个帅气逼人、雄姿英发；俄媒称中国人已超越所有仪仗队，他们出色的一致性，分毫不差步调一致，完全颠覆了。
2529,安康：安康烈士陵园近年被不少非烈士人员侵占，包括众多安康籍、或曾在任职的前官员及部分在任官员的亲属；媒体称纪检机关启动追查问责，并确定立即追责
2530,官网宣布，加拿大中后卫布坎南入围2015女足世界杯最佳新人奖，中国中场唐佳丽入围
2531,习近平主持中央军委深化国防和军队改革领导小组第一次全体会议，强调要坚持用强军目标审视改革，确保深化改革工作起好步、开好局，要继续加强教育和引导
2532,组图：中国足球世界杯足球赛首轮，中国队客场0-0不敌巴西队
2533,今日凌晨4时许，沪昆高速贵州省麻江县境内因暴雨引发山体滑坡，双向道路被阻，目前尚不清楚有无车辆和人员被埋，现场滑坡方量较大有无人被被埋。
2534,哈尔滨：15岁少年炫富欲买路虎车，被骗后消失，称不能套牌，称不能满足自己在圈子里的优越感；因怕被骗，特意进入卖家的空间买车(图)
2535,网曝河北平山县安监局一名韩副局长上班时间酣睡卧床接待访民，举报后仅被通报批评；官方回应称其系承租的一处下游下游，官方否认视频由承租下游(图)
2536,日媒称中国不会考虑采取珍珠链战略，双用途物流设施模式将是未来中国发展趋势；美国国防大学学者认为中国很可能会做出改变，但中国或做出调整。
2537,威海市发布暴雪橙色预警：目前，市区降雪量已经超过10毫米，文登接近15毫米；预计未来北部地区降雨仍将持续，为此，威海气象台于12月5日14时将暴雪黄色预
2538,沧州：男子不和我搞对象，我就在社区贴满你的裸照，看你的脸能否大过屁股；民警一齐上阵，将其抓获归案；女子曾因强奸罪被判刑7年，曾因因强暴罪获刑。
2539,丹江口一男子因家庭琐事拌嘴，一气之下喝下半瓶农药欲自杀，幸亏医务人员第一时间将其送医抢救，脱离生命危险；男子与妻子因琐事吵架，一口气喝下农药。
2540,西安：56岁保安3年来多次性侵一名幼女，父亲与保安曾是同事；孩子平时叫他爷爷他却变成禽兽伤害；该幼女平时称他爷奶却变为禽兽，已被警方刑拘(组图)
2541,漳州市委党校大院现，全身褐色大鸟脚绑绳子，在大树上飞翔跳跃引众人注意，专家担心受伤，展开捕捉无果；专家称蛇雕被古人认为身有剧毒可制毒酒。
2542,意甲公布2015-16赛季意甲赛程，新赛季将在8月22日重燃战火，米兰客战强敌佛罗伦萨，国米主场迎战亚特兰大
2543,泰州市发布雷电黄色预警：目前，我市兴化地区已出现雷阵雨，预计未来6小时内我市大部分地区将出现...
2544,受电网春季检修影响，沈阳皇姑区部分区域5月7日7:00至21:00临时停电，上述单位当日不能正常办理业务，上午社保大厦和社保中厦等公司停电1天，暂停对
2545,十堰：文盲文盲母亲虐待亲生女儿致其伤重夭亡，尸检时发现其严重营养不良瘦骨嶙峋，浑身溃烂；检察官称其因涉嫌虐待罪被批捕。
2546,河南南召一男子见父亲被殴打，回家抄刀砍死堂兄后潜逃，2000多名村民自发为除恶英雄，2000余村民为其保密；被当作除恶雄雄；2000多人自发保密命案(图)
2547,安徽庐江一民宅楼顶发现一枚导弹，弹头有红箭字迹，弹身有黄箭，推测是上世纪八十年代使用的；警方称系上世代八十余年使用，疑为红箭系列导弹。
2548,老家一中学教师每隔两小时必须进餐，每隔2小时就必须吃饭，每天一天要吃10顿饭，最多的一天吃上10顿，称永不足的胃口，为了永不能胃(图)
2549,西安至海口有望有直达高铁，从西安到陕西安康、湖南、海南，是一条承载国家战略的高铁通道，将连接丝绸之路经济带新起点湖北、湖北，将按时速350公里
2550,余额宝上线以来首次出现此类故障，系统升级所致；系统称系统降级，但不影响收益产生和发放；此次故障为系统上线后第一天收益。
2551,中央司法改革领导小组办公室负责人姜伟：由于周永康已不担任中央领导职务，这次全会没有作出相关决定。
2552,中泰签署一带一路合作备忘录，初估耗时10年、投资总额280亿美元，一旦开通，大陆马六甲困局也将迎刃而解。
2553,洛阳脑瘫女孩文科556分文科597分，高出一本线84分；专业上人大可随便挑，专业也可随意挑；母亲称考试难度较大，希望考外地名校，愿意报外地高校(图)
2554,庆阳：85后老板因涉嫌欺骗他人吸毒被提起公诉；经理将5名姑娘倒进酒杯中加入粉，致其头脑发烫、身体发烫等症状，后两人被工作人员搀扶到包厢。
2555,曝中国足协负责正常运转的人员仅有区区68人，足协规模在过去一年内已一缩再缩，官方回应称足协人数和户县足协的人数差不多，官员称足总人数仅有1人左右
2556,渭南潼关一民居私藏炸药爆炸致2男子死亡5人受伤，5名伤者均为开矿的亲戚，警方已介入调查
2557,国家信息中心主任张新红谈互联网经济：中国的机遇与选择：从网民人数和普及率看中国潜力；从网络人数、普及度看中國潜力，去年底时全球互联網用户达30亿
2558,渭南：韩城国土资源局原局长徐建龙被开除党籍，称与他人订立攻守同盟，对抗组织调查；专家称有干扰、妨碍组织审查行为的，可依规定从重或者加重处分。
2559,金华：义乌公务员上班时间频繁开房，网曝两公务人上班期间多次开房；官方回应称纪委已介入调查，相关部门纪委正介入
2560,组图：成都军区军区装备部副部长杨光跃出任四川省军区司令员，此前担任军区副司令的是李亚洲少将；李光跃曾任省总队副令员、武警四川总队司令
2561,武汉：23岁女孩地铁遭抢劫，手机和平板电脑被抢，脸部被划伤；两名见义勇为的市民两度追赶劫匪，成功追回女孩被抢的物品后悄然离去；目击者称女孩已送医
2562,河南人大原秘书长、三门峡市原市委书记连子恒受贿罪、巨额财产来源不明罪、非法持有枪支弹药罪，被控受贿数百余万，非法拥有枪枝、美元28万。
2563,龙岩一厨师与老板外出，半夜被发现躺在出租屋楼下，5天后死亡，事发时丈夫仍未归，打通电话铃声响起铃声，丈夫未回家；事发后丈夫还未归打通铃声(图)
2564,季后赛：辽宁121-105击败广厦，哈德森36分10篮板，汤普森27分，辽宁陷犯规危机，张涵钧破门，哈普森17分，苏若禹17+8，辽厦陷犯規危机张伟罚中一球。
2565,湖南衡阳破坏选举案一审宣判，68名上诉人中有11人维持原判；衡阳市委原常委肖斌玩忽职守案被判3年，其中10人因二审认定其有立功情节予以改判。
2566,柳州：两名工人上门讨薪被老板反锁在家，饿10多小时后才报警求助；因欠薪被房东反锁大门，两人饿10余小时才脱身；因拖欠30多名工作人员，无法解决(图)
